number,user,restaurant_names
193,ojkg8l3E_FDNnAqjKtEioQ,"8PmbCVEjWGPouD1Tst6FsQ, xWuzWH8qYaa75REqVd9Isw, E7s0QreUJ2H9r0Ls1yDeiQ, Q0fcX_1wvdmffqEPa246rg, 8Haoz9Mil7ZnHGU48sgBtw, ZOyBVpeSQ7sYDeZa_v0MFw, nJdNzQ5Z278gTCFJ4HQBLA, cBHMUESPj4SNs65Xv6xWRA, 2vOHS-_p5ylEf0BGR1dO9w, gtx0OZnN98YXAASyMzv3hw"
194,Yt_y59nDDmf1lDepYnshtA,"E7s0QreUJ2H9r0Ls1yDeiQ, NW3KM7K7ywzEfqk3OR4tAQ, 2HMvoTz_hw0noLzBWmyxcA, z-3ZDmVbHZjDrYZE42yKZA, GdzCnx5OWURyklzTjaQIPw, W-kOZ946xRWBJZvxXhJ7DA, vL44Ky9VxUtOgteyHasRIA, PiT0jyLL2Jwm2ODTDapOcg, ZOyBVpeSQ7sYDeZa_v0MFw, cgEzHZQKhi2anXfyF75MQw"
195,ud0mbXHCpQ9mxQrQfwUemg,"AUiX65HxQqwk1yvsBcbTdQ, 2vOHS-_p5ylEf0BGR1dO9w, se9MhDAQjACYMO3LCIfT1Q, z57omnqRcAODGwbwMHEIyw, Q0fcX_1wvdmffqEPa246rg, Jwp4UFa93ENe-0REPo5hCQ, xOZ7bkrttSIGS4NZm49w5Q, xbCNlp2vWixy2W1WsfGv8g, nJdNzQ5Z278gTCFJ4HQBLA, S1eha-aT5c7WMk7lDLsW0A"
196,7vZzu-o3eCgQaf7nPfYY5A,"563C7-HcjhZwZSl4fK-mfQ, cgEzHZQKhi2anXfyF75MQw, 366NwqHwhOic5pBN1DjmDQ, EiYE3T3hfqcpcficZ4zJzQ, XahLCgicRsLPb0TSMAIQtw, nJdNzQ5Z278gTCFJ4HQBLA, nbJXmGpdCxiBnovBkBtWcA, DdfvQ1hZOB0-ra7pu-wwoA, 8axxI33rUyswfRk_v3vS0A, xCeiBRuvqYXDXp9Vw7gmXw"
197,AV17hCPp3TJckyHT21i9lw,"xOZ7bkrttSIGS4NZm49w5Q, hz0ldhBHu5M4ri9M_mkOdQ, g_fGPZJlGeKGLgC-j-tj6w, z57omnqRcAODGwbwMHEIyw, sH-11zOhWubXobEeuMo2gg, 563C7-HcjhZwZSl4fK-mfQ, ZOyBVpeSQ7sYDeZa_v0MFw, Q0fcX_1wvdmffqEPa246rg, aJvi4k0ndFlGBzSZzcbnTw, XarxHcmxyjvhzoROMTLyMg"
198,-V3iXmuL568kFvfJKBXROA,"47Uu-2MceSRFmohdzCOvGQ, se9MhDAQjACYMO3LCIfT1Q, g_fGPZJlGeKGLgC-j-tj6w, BmrVL3Aj5usPfpu5DE1iCg, xWuzWH8qYaa75REqVd9Isw, gtx0OZnN98YXAASyMzv3hw, GS06uO84yKQpa7oezgVZgQ, gFs3KFdrsnhRxOFj_DF6fw, KL1oif2ocGH2dJ4w-oT_Mg, 366NwqHwhOic5pBN1DjmDQ"
199,KMrUM3hIAjbRJbZ_pbcUxQ,"nJdNzQ5Z278gTCFJ4HQBLA, z57omnqRcAODGwbwMHEIyw, KMlY-L1oAL3qMQnwQCJPhQ, pM4mWLjeaZJlcdUxut2lMg, _jNe_vwxiEh0G9JRZByc0w, gqsU03i-WiyYHcBCdwObuQ, se9MhDAQjACYMO3LCIfT1Q, Q0fcX_1wvdmffqEPa246rg, xOZ7bkrttSIGS4NZm49w5Q, IWNPEvd3o6GHi60MxnPCVQ"
200,_NvaWihvoqp0ZZfkhG3sig,"se9MhDAQjACYMO3LCIfT1Q, FMoKoSHgitwnt_iMWm31nQ, 9RKjjuTQYkYpGmCtfVsTZQ, 563C7-HcjhZwZSl4fK-mfQ, E7s0QreUJ2H9r0Ls1yDeiQ, 0HyuO5rOKeaa08TFzjIJIA, tD1veHsKELAH3b7wKmHsaw, z57omnqRcAODGwbwMHEIyw, MuVIpRAEkNfRnmhsPTdl3A, l_tk3iLmyKfBUCK-6nBbHg"
201,mbtri0iWlGf-Qd25JQ_UBA,"xbCNlp2vWixy2W1WsfGv8g, 563C7-HcjhZwZSl4fK-mfQ, vL44Ky9VxUtOgteyHasRIA, hz0ldhBHu5M4ri9M_mkOdQ, Nvi9RLcOdrJvSwcw-ziZQQ, Q0fcX_1wvdmffqEPa246rg, FMoKoSHgitwnt_iMWm31nQ, gJliACNKY4rK30BTMIzwsQ, Kcg5iMwYq5ibBuEhDXKx3Q, QIvn4fWw2bE53kgePK7oEQ"
202,2ROguWudHPAM-m5DNRvMPQ,"ZMcd7w-yDhFRLSwvJBV1VQ, R79Hir871EF-kRLIBPy9qg, adI5BlJCtvWq2uAwmyndXA, J_KI8rJa_dSwTglUbwFcdw, xbCNlp2vWixy2W1WsfGv8g, 5Iin0tl6QJT_TyL1BldtyA, 2HMvoTz_hw0noLzBWmyxcA, wXob57ntnAnzSEWnt9syEQ, qeFGUu1WPvMMNn5Hno6D-Q, z57omnqRcAODGwbwMHEIyw"
203,0lgr88M1Wdzy9iBQbL6L2g,"Q0fcX_1wvdmffqEPa246rg, 563C7-HcjhZwZSl4fK-mfQ, se9MhDAQjACYMO3LCIfT1Q, 2HMvoTz_hw0noLzBWmyxcA, QMySP-qHdwQNZY0gDba0ng, 5Iin0tl6QJT_TyL1BldtyA, E7s0QreUJ2H9r0Ls1yDeiQ, S1eha-aT5c7WMk7lDLsW0A, 36jGZp7V0jLnPCYmRipUCg, K8D_ltZWGvdXUaSE7bBiDw"
204,B-edcZUr01jugv_B29plDw,"PiT0jyLL2Jwm2ODTDapOcg, ksP8426d2qN-mg-JDpkRVQ, BmrVL3Aj5usPfpu5DE1iCg, B9gUwTS1_Yzj2vajjC7Vmg, 47Uu-2MceSRFmohdzCOvGQ, sjrTFzrb7_pzzBEpC-BvpA, xOZ7bkrttSIGS4NZm49w5Q, 5do7Z64Lh60BOJiZed7YJQ, z57omnqRcAODGwbwMHEIyw, KMlY-L1oAL3qMQnwQCJPhQ"
205,SfY0jEFqBkrqq9bVi6P31Q,"nJdNzQ5Z278gTCFJ4HQBLA, 4owK2zpqI7qQ774DSNTkjQ, l_tk3iLmyKfBUCK-6nBbHg, qeFGUu1WPvMMNn5Hno6D-Q, 9RKjjuTQYkYpGmCtfVsTZQ, 3hjLxqqEfnBhwL6ecave_g, utYpyFOjNisHl1h7lDGSGA, IgicVjRYx6fB5n5z4t6xBA, AUiX65HxQqwk1yvsBcbTdQ, s7TMkWF36dwwD8R3TKsJqw"
206,T6W1v13bzNQM20vrAcTYHg,"nJdNzQ5Z278gTCFJ4HQBLA, 366NwqHwhOic5pBN1DjmDQ, GS06uO84yKQpa7oezgVZgQ, B9gUwTS1_Yzj2vajjC7Vmg, BmrVL3Aj5usPfpu5DE1iCg, E7s0QreUJ2H9r0Ls1yDeiQ, KMlY-L1oAL3qMQnwQCJPhQ, klzCMxmhrHWZeNseS4GKFg, xWuzWH8qYaa75REqVd9Isw, 563C7-HcjhZwZSl4fK-mfQ"
207,jJ-MRytfgNEzutY8TBxJKw,"sH-11zOhWubXobEeuMo2gg, 6MR9GZjWjLAS3s39YdDXKw, xbCNlp2vWixy2W1WsfGv8g, z57omnqRcAODGwbwMHEIyw, l_tk3iLmyKfBUCK-6nBbHg, xOZ7bkrttSIGS4NZm49w5Q, KMlY-L1oAL3qMQnwQCJPhQ, YST4gp2ecFtyUpRAFNZ_HQ, KWPhAfod__yKvjH-LG4bjg, e8ohWYW8rbOZWZ4pojU4zQ"
208,sP_NnexHbu0eqJVmtCOZQQ,"te-QMdSMQdjws6NnRexjJQ, cgEzHZQKhi2anXfyF75MQw, nJdNzQ5Z278gTCFJ4HQBLA, hJNjKc4sKgWG__KitlJ1ag, se9MhDAQjACYMO3LCIfT1Q, AUiX65HxQqwk1yvsBcbTdQ, APN05ziH92oIox8EMxcceg, Q0fcX_1wvdmffqEPa246rg, BmrVL3Aj5usPfpu5DE1iCg, SD3ZyFR5ZjFneWpYhT6tLg"
209,XyOlmy-Tc6DPfw5stMJ_zA,"xjBvbDmbsA0VX-vA55SbAA, 563C7-HcjhZwZSl4fK-mfQ, SD3ZyFR5ZjFneWpYhT6tLg, g_fGPZJlGeKGLgC-j-tj6w, nJdNzQ5Z278gTCFJ4HQBLA, 2vOHS-_p5ylEf0BGR1dO9w, Rx85NUdD6MhrgKxHr05NlQ, hJNjKc4sKgWG__KitlJ1ag, se9MhDAQjACYMO3LCIfT1Q, V8vKFvdrvhTrQrt-rxKrPA"
210,1Xm4Nea4ikRokE0Nlt-dwg,"z57omnqRcAODGwbwMHEIyw, xOZ7bkrttSIGS4NZm49w5Q, g_fGPZJlGeKGLgC-j-tj6w, 47Uu-2MceSRFmohdzCOvGQ, 4NWMr9xSPImqdwDgYvrwXQ, GS06uO84yKQpa7oezgVZgQ, S1eha-aT5c7WMk7lDLsW0A, vL44Ky9VxUtOgteyHasRIA, 6MR9GZjWjLAS3s39YdDXKw, 41vgh9z4OSJfbgOy57qh0Q"
211,JkP7WtmnqmGctb1QFulVcw,"se9MhDAQjACYMO3LCIfT1Q, E7s0QreUJ2H9r0Ls1yDeiQ, AUiX65HxQqwk1yvsBcbTdQ, 563C7-HcjhZwZSl4fK-mfQ, 22nkIQ4BeSYwsyaPOczOeA, L4ivYHVCDpIE0SrPaCn0LA, K8D_ltZWGvdXUaSE7bBiDw, aHYIubjRbTLB3o_eXkrMXA, qeFGUu1WPvMMNn5Hno6D-Q, nJdNzQ5Z278gTCFJ4HQBLA"
212,KerXo7TQpmSSeZIv7zXxzw,"se9MhDAQjACYMO3LCIfT1Q, adI5BlJCtvWq2uAwmyndXA, 8PmbCVEjWGPouD1Tst6FsQ, W-kOZ946xRWBJZvxXhJ7DA, 563C7-HcjhZwZSl4fK-mfQ, V8vKFvdrvhTrQrt-rxKrPA, utYpyFOjNisHl1h7lDGSGA, nbF7bEjx_4lQJ3t6aVqFjA, hz0ldhBHu5M4ri9M_mkOdQ, qeFGUu1WPvMMNn5Hno6D-Q"
213,IpE_BSBMUl55FJfsi7-tuQ,"nJdNzQ5Z278gTCFJ4HQBLA, xWuzWH8qYaa75REqVd9Isw, z57omnqRcAODGwbwMHEIyw, Q0fcX_1wvdmffqEPa246rg, se9MhDAQjACYMO3LCIfT1Q, 563C7-HcjhZwZSl4fK-mfQ, Sagzs4cd0ruWEK_T9DaFHg, GdzCnx5OWURyklzTjaQIPw, 6MR9GZjWjLAS3s39YdDXKw, _TqUO2XaxLQ9i_z3RM8puQ"
214,mTH7-QA2H9auoUi9no10Ww,"E_scgX9Vws9adbh4i_QJnQ, KL1oif2ocGH2dJ4w-oT_Mg, se9MhDAQjACYMO3LCIfT1Q, E7s0QreUJ2H9r0Ls1yDeiQ, QMySP-qHdwQNZY0gDba0ng, EiYE3T3hfqcpcficZ4zJzQ, nJdNzQ5Z278gTCFJ4HQBLA, 8PmbCVEjWGPouD1Tst6FsQ, 563C7-HcjhZwZSl4fK-mfQ, gtx0OZnN98YXAASyMzv3hw"
215,ctatGRZqs9urE-OfV1rDug,"l_tk3iLmyKfBUCK-6nBbHg, gtx0OZnN98YXAASyMzv3hw, Rx85NUdD6MhrgKxHr05NlQ, 366NwqHwhOic5pBN1DjmDQ, csbBCysrsifg8N10c0eHCA, cgEzHZQKhi2anXfyF75MQw, hz0ldhBHu5M4ri9M_mkOdQ, qDPn14lenAGehkbnJaqnYg, EiYE3T3hfqcpcficZ4zJzQ, 7Oi6eT_-h_9JlMqRsEdt3A"
216,7jhPCj640UXpNKlwgZbKYA,"IYdv6RxSiqz2XMsqkiTmPQ, aJkxkjYvi89gHIOomnjGVQ, qesu3mk5yHeak9CUO4gRdQ, qmcIsZjLpxd0V4RekSozmA, vL44Ky9VxUtOgteyHasRIA, xWuzWH8qYaa75REqVd9Isw, ZOyBVpeSQ7sYDeZa_v0MFw, W-kOZ946xRWBJZvxXhJ7DA, 4owK2zpqI7qQ774DSNTkjQ, z57omnqRcAODGwbwMHEIyw"
217,XrLXLru68mqIire2txXD7Q,"z57omnqRcAODGwbwMHEIyw, l_tk3iLmyKfBUCK-6nBbHg, xCeiBRuvqYXDXp9Vw7gmXw, gqsU03i-WiyYHcBCdwObuQ, EIZnpMr9ccgutaGzGjzZ9g, Rx85NUdD6MhrgKxHr05NlQ, xbCNlp2vWixy2W1WsfGv8g, lrPNLw0zbfzgWrWINMjsNw, 7Oi6eT_-h_9JlMqRsEdt3A, 563C7-HcjhZwZSl4fK-mfQ"
218,8b5H6tG1riOQw2mEVrO--A,"z57omnqRcAODGwbwMHEIyw, jAdh1mDxSCCOmV_6UpYMow, vL44Ky9VxUtOgteyHasRIA, S1eha-aT5c7WMk7lDLsW0A, sH-11zOhWubXobEeuMo2gg, qesu3mk5yHeak9CUO4gRdQ, t4pxMWLb7wDMsmURxYkUYQ, aIs7Tt3pw6ymj3FOPPR4Ng, pM4mWLjeaZJlcdUxut2lMg, yYh6t6a_0LGLVS_MNYEHsQ"
219,10RpPp6zKOTkJwE6JE7Ung,"W-kOZ946xRWBJZvxXhJ7DA, OvbLKXkJCg8ZMHX9L5faIA, vy5dhJyQ_VC1NUpPMmRUlw, z57omnqRcAODGwbwMHEIyw, x5stEsLXNzS3WTy5YhdLlA, 8PmbCVEjWGPouD1Tst6FsQ, L4ivYHVCDpIE0SrPaCn0LA, 0XcOq9ibk5DSXGcX1d0_rA, ZOyBVpeSQ7sYDeZa_v0MFw, mX58qv1o62qWtP4OsIYdYg"
220,nr3S8p-lpf7K9W58eo_mLQ,"mVZoin0a8uTZgLsgJ9iNDQ, 8PmbCVEjWGPouD1Tst6FsQ, -JPz4W7MPOy-rQO8OKNk0g, 6MR9GZjWjLAS3s39YdDXKw, nbJXmGpdCxiBnovBkBtWcA, Q0fcX_1wvdmffqEPa246rg, APN05ziH92oIox8EMxcceg, KL1oif2ocGH2dJ4w-oT_Mg, z-3ZDmVbHZjDrYZE42yKZA, x1bjSvpIJTN1KBFhUjOU_g"
221,K1tDoNEHiaAi-k4SFhCAng,"gONO6UIMj8kFo1IvnROuuQ, 563C7-HcjhZwZSl4fK-mfQ, S1eha-aT5c7WMk7lDLsW0A, 2HMvoTz_hw0noLzBWmyxcA, xWuzWH8qYaa75REqVd9Isw, krvqEVmPnJJYA9ngZCHX2w, se9MhDAQjACYMO3LCIfT1Q, qesu3mk5yHeak9CUO4gRdQ, xbCNlp2vWixy2W1WsfGv8g, xjBvbDmbsA0VX-vA55SbAA"
222,0VyDSM1uIrTU8LfaFh8JdA,"BXeXS9EaNN03AptFwElvjA, S1eha-aT5c7WMk7lDLsW0A, xbCNlp2vWixy2W1WsfGv8g, LUhVj-r2TtmFx6cyF9ilJg, csbBCysrsifg8N10c0eHCA, S9XKKA1evhRh16zrXpSF7g, hJNjKc4sKgWG__KitlJ1ag, sH-11zOhWubXobEeuMo2gg, nJdNzQ5Z278gTCFJ4HQBLA, hz0ldhBHu5M4ri9M_mkOdQ"
223,TNxBN-tg_2U0vBnTw-LZKQ,"Rx85NUdD6MhrgKxHr05NlQ, nJdNzQ5Z278gTCFJ4HQBLA, 563C7-HcjhZwZSl4fK-mfQ, 6Kl2SQp-zGo-nsdImLykxw, AUiX65HxQqwk1yvsBcbTdQ, e8ohWYW8rbOZWZ4pojU4zQ, qDPn14lenAGehkbnJaqnYg, 8PmbCVEjWGPouD1Tst6FsQ, MuVIpRAEkNfRnmhsPTdl3A, pM4mWLjeaZJlcdUxut2lMg"
