number,user,restaurant_names
97,J7Hl7OCQcFjmUerZhcwxOw,"I1j1kEbQ5BliKsjzl5etVA, z57omnqRcAODGwbwMHEIyw, s7TMkWF36dwwD8R3TKsJqw, 563C7-HcjhZwZSl4fK-mfQ, hz0ldhBHu5M4ri9M_mkOdQ, cgEzHZQKhi2anXfyF75MQw, V8vKFvdrvhTrQrt-rxKrPA, nJdNzQ5Z278gTCFJ4HQBLA, xWuzWH8qYaa75REqVd9Isw, qeFGUu1WPvMMNn5Hno6D-Q"
98,zjj6fK65LRB4WNlE8Qt3lg,"563C7-HcjhZwZSl4fK-mfQ, EiYE3T3hfqcpcficZ4zJzQ, E7s0QreUJ2H9r0Ls1yDeiQ, xOZ7bkrttSIGS4NZm49w5Q, Q0fcX_1wvdmffqEPa246rg, 6MR9GZjWjLAS3s39YdDXKw, x5stEsLXNzS3WTy5YhdLlA, aHYIubjRbTLB3o_eXkrMXA, 2vOHS-_p5ylEf0BGR1dO9w, F3xksTtZUfanOcLQqJn0eQ"
99,W1vp1LjV8rkCOIYFCAACdg,"PiT0jyLL2Jwm2ODTDapOcg, B9gUwTS1_Yzj2vajjC7Vmg, sH-11zOhWubXobEeuMo2gg, S1eha-aT5c7WMk7lDLsW0A, cBHMUESPj4SNs65Xv6xWRA, DMP1E6NfBkTfhRn5cbHSuw, BmrVL3Aj5usPfpu5DE1iCg, xOZ7bkrttSIGS4NZm49w5Q, FMoKoSHgitwnt_iMWm31nQ, xbCNlp2vWixy2W1WsfGv8g"
100,c17s5z5V4_ppX4w6TZdFDg,"vL44Ky9VxUtOgteyHasRIA, F3xksTtZUfanOcLQqJn0eQ, hJNjKc4sKgWG__KitlJ1ag, Vtahv3Af90H3fUuEEhPhdQ, w8XAYTSIcAHvRWTHUtgTVQ, APN05ziH92oIox8EMxcceg, E_scgX9Vws9adbh4i_QJnQ, 2HMvoTz_hw0noLzBWmyxcA, 8PmbCVEjWGPouD1Tst6FsQ, cgEzHZQKhi2anXfyF75MQw"
101,cqecqnFK2eu88VtKJLHpiA,"563C7-HcjhZwZSl4fK-mfQ, E7s0QreUJ2H9r0Ls1yDeiQ, KMlY-L1oAL3qMQnwQCJPhQ, vL44Ky9VxUtOgteyHasRIA, 3hjLxqqEfnBhwL6ecave_g, S1eha-aT5c7WMk7lDLsW0A, nJdNzQ5Z278gTCFJ4HQBLA, QMySP-qHdwQNZY0gDba0ng, Q0fcX_1wvdmffqEPa246rg, hf_TA4bRRnzLQh2XUbqX6w"
102,l8gCfUNUdO64TtIv71UUaA,"FMoKoSHgitwnt_iMWm31nQ, E7s0QreUJ2H9r0Ls1yDeiQ, _eg8IWyKJe1QlXAbQqeemw, N1BTJaWnLsCVsJ3I41EPdg, hf_TA4bRRnzLQh2XUbqX6w, aHYIubjRbTLB3o_eXkrMXA, S1eha-aT5c7WMk7lDLsW0A, LUhVj-r2TtmFx6cyF9ilJg, GS06uO84yKQpa7oezgVZgQ, J_KI8rJa_dSwTglUbwFcdw"
103,0tuicLSSRM8eCyVhIG5QeQ,"xWuzWH8qYaa75REqVd9Isw, 563C7-HcjhZwZSl4fK-mfQ, VdBpfLna-sn83cdKmSkxOg, Rx85NUdD6MhrgKxHr05NlQ, nJdNzQ5Z278gTCFJ4HQBLA, xbCNlp2vWixy2W1WsfGv8g, FMoKoSHgitwnt_iMWm31nQ, I1j1kEbQ5BliKsjzl5etVA, se9MhDAQjACYMO3LCIfT1Q, r3U-3yOP1ZB8Yu8Gv0Auwg"
104,LZr86Mk7R8dxkh2Jo2NGWw,"LUhVj-r2TtmFx6cyF9ilJg, EIZnpMr9ccgutaGzGjzZ9g, cgEzHZQKhi2anXfyF75MQw, vL44Ky9VxUtOgteyHasRIA, 8PmbCVEjWGPouD1Tst6FsQ, W-kOZ946xRWBJZvxXhJ7DA, pdrWG2TVIXyRR_pN9bXs0Q, nbF7bEjx_4lQJ3t6aVqFjA, nJdNzQ5Z278gTCFJ4HQBLA, 18DgI5IfaAo2hmu2gs8WxQ"
105,4YH_x__cYF_y8QtaQcYYFg,"E7s0QreUJ2H9r0Ls1yDeiQ, yYh6t6a_0LGLVS_MNYEHsQ, vy5dhJyQ_VC1NUpPMmRUlw, P_q9rwxm-O-8cQ3xiswHHg, 2HMvoTz_hw0noLzBWmyxcA, z-3ZDmVbHZjDrYZE42yKZA, 8PmbCVEjWGPouD1Tst6FsQ, nJdNzQ5Z278gTCFJ4HQBLA, vL44Ky9VxUtOgteyHasRIA, 563C7-HcjhZwZSl4fK-mfQ"
106,1s_F5PS7L8Azn50w860O7w,"nbJXmGpdCxiBnovBkBtWcA, hJNjKc4sKgWG__KitlJ1ag, Q0fcX_1wvdmffqEPa246rg, zc_ptb03jQiXnWGwmpAk0A, V8vKFvdrvhTrQrt-rxKrPA, KL1oif2ocGH2dJ4w-oT_Mg, xWuzWH8qYaa75REqVd9Isw, FMoKoSHgitwnt_iMWm31nQ, se9MhDAQjACYMO3LCIfT1Q, BmrVL3Aj5usPfpu5DE1iCg"
107,0sGiC_VQubXxFEkg-OLqyw,"csbBCysrsifg8N10c0eHCA, mSSH1BFPQJ41gmPiN9_jwg, LUhVj-r2TtmFx6cyF9ilJg, D2smJ2r0RrVoe0aGlT-2wA, Fx4ONDdL_3eM-KCQ49WUSQ, _TqUO2XaxLQ9i_z3RM8puQ, ZOyBVpeSQ7sYDeZa_v0MFw, Vtahv3Af90H3fUuEEhPhdQ, xbCNlp2vWixy2W1WsfGv8g, tuucCa40AmTMUEVNerGe9w"
108,x_B6HetResuFzznXnVyEog,"3hjLxqqEfnBhwL6ecave_g, xbCNlp2vWixy2W1WsfGv8g, rvOvog5Utw3VXBwiSCAl0A, 2HMvoTz_hw0noLzBWmyxcA, hJNjKc4sKgWG__KitlJ1ag, QMySP-qHdwQNZY0gDba0ng, z-3ZDmVbHZjDrYZE42yKZA, BmrVL3Aj5usPfpu5DE1iCg, F3xksTtZUfanOcLQqJn0eQ, hz0ldhBHu5M4ri9M_mkOdQ"
109,NV0u95G-WcjZRAfCX-jcWw,"xWuzWH8qYaa75REqVd9Isw, 6MR9GZjWjLAS3s39YdDXKw, cgEzHZQKhi2anXfyF75MQw, E7s0QreUJ2H9r0Ls1yDeiQ, V8vKFvdrvhTrQrt-rxKrPA, s7TMkWF36dwwD8R3TKsJqw, xOZ7bkrttSIGS4NZm49w5Q, I1j1kEbQ5BliKsjzl5etVA, ZOyBVpeSQ7sYDeZa_v0MFw, LUhVj-r2TtmFx6cyF9ilJg"
110,0S2KCUzFvnWvlRWaDMz7Ng,"KL1oif2ocGH2dJ4w-oT_Mg, Q0fcX_1wvdmffqEPa246rg, nJdNzQ5Z278gTCFJ4HQBLA, aJvi4k0ndFlGBzSZzcbnTw, E7s0QreUJ2H9r0Ls1yDeiQ, GS06uO84yKQpa7oezgVZgQ, JOqWln_EB_f6RUSTxl04dQ, 563C7-HcjhZwZSl4fK-mfQ, BmrVL3Aj5usPfpu5DE1iCg, xbCNlp2vWixy2W1WsfGv8g"
111,wK7unWb9i25ekCP37sWtfQ,"kYDkMGQEuQIeSOGZHHjIxA, 6MR9GZjWjLAS3s39YdDXKw, cgEzHZQKhi2anXfyF75MQw, vL44Ky9VxUtOgteyHasRIA, E8PkjCmDnDE7_2rYf38lRA, aJkxkjYvi89gHIOomnjGVQ, oAsjdHwXgKtK-NU_JEYuPg, XahLCgicRsLPb0TSMAIQtw, e8ohWYW8rbOZWZ4pojU4zQ, mVZoin0a8uTZgLsgJ9iNDQ"
112,7aPagLrqA9U1lXluIMP65g,"xWuzWH8qYaa75REqVd9Isw, e8ohWYW8rbOZWZ4pojU4zQ, 563C7-HcjhZwZSl4fK-mfQ, WUAe0FGaLRCremEDXqNV4A, z57omnqRcAODGwbwMHEIyw, EKEPtNKJdZxRhYoFhuG8ew, AUiX65HxQqwk1yvsBcbTdQ, GbRN507iOJ6JOU-dixk-PQ, 366NwqHwhOic5pBN1DjmDQ, EiYE3T3hfqcpcficZ4zJzQ"
113,jCMdF94UyMHEi6iv8ys-gg,"KL1oif2ocGH2dJ4w-oT_Mg, vL44Ky9VxUtOgteyHasRIA, KMlY-L1oAL3qMQnwQCJPhQ, xbCNlp2vWixy2W1WsfGv8g, z57omnqRcAODGwbwMHEIyw, 3hjLxqqEfnBhwL6ecave_g, 563C7-HcjhZwZSl4fK-mfQ, hJNjKc4sKgWG__KitlJ1ag, QMySP-qHdwQNZY0gDba0ng, E7s0QreUJ2H9r0Ls1yDeiQ"
114,avbAP7ZQpDUgNcDywZtCsg,"se9MhDAQjACYMO3LCIfT1Q, l_tk3iLmyKfBUCK-6nBbHg, Q0fcX_1wvdmffqEPa246rg, z57omnqRcAODGwbwMHEIyw, _jNe_vwxiEh0G9JRZByc0w, hJNjKc4sKgWG__KitlJ1ag, 36jGZp7V0jLnPCYmRipUCg, MuVIpRAEkNfRnmhsPTdl3A, xWuzWH8qYaa75REqVd9Isw, EIZnpMr9ccgutaGzGjzZ9g"
115,4A0Fjisy8aO4ObsKMBdKhQ,"VecnSuJm8sD83LWJ_KqAtg, vL44Ky9VxUtOgteyHasRIA, 8PmbCVEjWGPouD1Tst6FsQ, 22nkIQ4BeSYwsyaPOczOeA, hJNjKc4sKgWG__KitlJ1ag, adI5BlJCtvWq2uAwmyndXA, 8Haoz9Mil7ZnHGU48sgBtw, qmcIsZjLpxd0V4RekSozmA, z-3ZDmVbHZjDrYZE42yKZA, W-kOZ946xRWBJZvxXhJ7DA"
116,PW50KG6menpoHdKeYLAvTg,"_jNe_vwxiEh0G9JRZByc0w, zc_ptb03jQiXnWGwmpAk0A, 563C7-HcjhZwZSl4fK-mfQ, YST4gp2ecFtyUpRAFNZ_HQ, 5Iin0tl6QJT_TyL1BldtyA, EiYE3T3hfqcpcficZ4zJzQ, gqsU03i-WiyYHcBCdwObuQ, E7s0QreUJ2H9r0Ls1yDeiQ, r3U-3yOP1ZB8Yu8Gv0Auwg, KMlY-L1oAL3qMQnwQCJPhQ"
117,3uugj6C_tFdRa8SmVevJFA,"Kcg5iMwYq5ibBuEhDXKx3Q, vL44Ky9VxUtOgteyHasRIA, 8PmbCVEjWGPouD1Tst6FsQ, W-kOZ946xRWBJZvxXhJ7DA, xbCNlp2vWixy2W1WsfGv8g, utYpyFOjNisHl1h7lDGSGA, CHrH99pDvs_jPA22o1xBAA, gXmhQb2v3l7x9Knm7BL8jQ, jHmFpryK4ide4iiqB3xSFQ, AEVNOYRr8ZsG1bj3NuEKgA"
118,yRm9czxWwbiJA-rtRAigcA,"z57omnqRcAODGwbwMHEIyw, Sqwa2aNwnqCmc95gVWQ9bA, 563C7-HcjhZwZSl4fK-mfQ, 6MR9GZjWjLAS3s39YdDXKw, l_tk3iLmyKfBUCK-6nBbHg, AUiX65HxQqwk1yvsBcbTdQ, xjBvbDmbsA0VX-vA55SbAA, xWuzWH8qYaa75REqVd9Isw, 8PmbCVEjWGPouD1Tst6FsQ, tD1veHsKELAH3b7wKmHsaw"
119,EWNjX2eqSWi5xHZ-iRR7QA,"se9MhDAQjACYMO3LCIfT1Q, EKEPtNKJdZxRhYoFhuG8ew, Iexv0Un2MfGEjHk8ejL8Ww, zc_ptb03jQiXnWGwmpAk0A, 8axxI33rUyswfRk_v3vS0A, rvOvog5Utw3VXBwiSCAl0A, Q0fcX_1wvdmffqEPa246rg, GS06uO84yKQpa7oezgVZgQ, LUhVj-r2TtmFx6cyF9ilJg, csbBCysrsifg8N10c0eHCA"
120,E68ZPVpcuWhxvnjq8vTqAA,"xOZ7bkrttSIGS4NZm49w5Q, 0SBDr7GJAFzKECE7IIWfJA, sH-11zOhWubXobEeuMo2gg, 22nkIQ4BeSYwsyaPOczOeA, E7s0QreUJ2H9r0Ls1yDeiQ, W-kOZ946xRWBJZvxXhJ7DA, z57omnqRcAODGwbwMHEIyw, qesu3mk5yHeak9CUO4gRdQ, xbCNlp2vWixy2W1WsfGv8g, L4ivYHVCDpIE0SrPaCn0LA"
121,QssDrW4xPnhnpx_nMo2Kow,"nJdNzQ5Z278gTCFJ4HQBLA, B9gUwTS1_Yzj2vajjC7Vmg, Q0fcX_1wvdmffqEPa246rg, 563C7-HcjhZwZSl4fK-mfQ, se9MhDAQjACYMO3LCIfT1Q, qeFGUu1WPvMMNn5Hno6D-Q, APN05ziH92oIox8EMxcceg, z57omnqRcAODGwbwMHEIyw, gqsU03i-WiyYHcBCdwObuQ, 366NwqHwhOic5pBN1DjmDQ"
122,M-RKuwyjIsgY-w9TGLKNSA,"ksP8426d2qN-mg-JDpkRVQ, hJNjKc4sKgWG__KitlJ1ag, E7s0QreUJ2H9r0Ls1yDeiQ, ZOyBVpeSQ7sYDeZa_v0MFw, cgEzHZQKhi2anXfyF75MQw, vy5dhJyQ_VC1NUpPMmRUlw, 22nkIQ4BeSYwsyaPOczOeA, PiT0jyLL2Jwm2ODTDapOcg, GdzCnx5OWURyklzTjaQIPw, u9iy3hyA9HpETKi9qns__A"
123,N0udGqfu8uh4Pa8OaV2ozQ,"cgEzHZQKhi2anXfyF75MQw, 6MR9GZjWjLAS3s39YdDXKw, xlHRYejgZj-iTm-QPhc8zQ, Q0fcX_1wvdmffqEPa246rg, hJNjKc4sKgWG__KitlJ1ag, 2vOHS-_p5ylEf0BGR1dO9w, PiT0jyLL2Jwm2ODTDapOcg, QMySP-qHdwQNZY0gDba0ng, 0SBDr7GJAFzKECE7IIWfJA, W-kOZ946xRWBJZvxXhJ7DA"
124,xYmJTCC4GowUQRsn-q0ZvA,"E7s0QreUJ2H9r0Ls1yDeiQ, 3hjLxqqEfnBhwL6ecave_g, se9MhDAQjACYMO3LCIfT1Q, xWuzWH8qYaa75REqVd9Isw, yF_fqO9cUUEyaIWhb-iOQQ, zc_ptb03jQiXnWGwmpAk0A, 0HyuO5rOKeaa08TFzjIJIA, Q0fcX_1wvdmffqEPa246rg, xEBRgLnqQ9bYkxTyyR3MNQ, W-kOZ946xRWBJZvxXhJ7DA"
125,N2bEXLOeKlYcaObv6UwmeQ,"BTDPN3hMRrENFZNb76lPKw, 3hjLxqqEfnBhwL6ecave_g, u9iy3hyA9HpETKi9qns__A, pM4mWLjeaZJlcdUxut2lMg, hJNjKc4sKgWG__KitlJ1ag, J_KI8rJa_dSwTglUbwFcdw, E7s0QreUJ2H9r0Ls1yDeiQ, EiYE3T3hfqcpcficZ4zJzQ, e8ohWYW8rbOZWZ4pojU4zQ, B9gUwTS1_Yzj2vajjC7Vmg"
126,SqVspkn4ivOfeBYgk-EIKA,"Vtahv3Af90H3fUuEEhPhdQ, AUiX65HxQqwk1yvsBcbTdQ, csbBCysrsifg8N10c0eHCA, 6MR9GZjWjLAS3s39YdDXKw, XarxHcmxyjvhzoROMTLyMg, V0tRCjf95FTqVJvmxdeqbQ, z57omnqRcAODGwbwMHEIyw, zc_ptb03jQiXnWGwmpAk0A, Rx85NUdD6MhrgKxHr05NlQ, E7s0QreUJ2H9r0Ls1yDeiQ"
127,3c57DbE5YVzaBqJzXTixcA,"563C7-HcjhZwZSl4fK-mfQ, WUAe0FGaLRCremEDXqNV4A, W-kOZ946xRWBJZvxXhJ7DA, z57omnqRcAODGwbwMHEIyw, se9MhDAQjACYMO3LCIfT1Q, Kcg5iMwYq5ibBuEhDXKx3Q, sgawLt-htNEwUh8Wmp3hHQ, vL44Ky9VxUtOgteyHasRIA, lWRbdK9YABr0auLG19FHhQ, lrPNLw0zbfzgWrWINMjsNw"
128,oy9owJElDBGC5kRZQmGxrw,"gqsU03i-WiyYHcBCdwObuQ, csbBCysrsifg8N10c0eHCA, 563C7-HcjhZwZSl4fK-mfQ, 366NwqHwhOic5pBN1DjmDQ, PcR-9sTQRK_UN7qO9rzDNw, xOZ7bkrttSIGS4NZm49w5Q, L4ivYHVCDpIE0SrPaCn0LA, N8hUGYmf0jEO9eDzmYHuAw, gFs3KFdrsnhRxOFj_DF6fw, 0SBDr7GJAFzKECE7IIWfJA"
129,23BfvNiCUERIKFu3w7ljUg,"6MR9GZjWjLAS3s39YdDXKw, AUiX65HxQqwk1yvsBcbTdQ, BmrVL3Aj5usPfpu5DE1iCg, E7s0QreUJ2H9r0Ls1yDeiQ, _TqUO2XaxLQ9i_z3RM8puQ, vL44Ky9VxUtOgteyHasRIA, pv4S2yOiWqH6AdFqzosZpw, xWuzWH8qYaa75REqVd9Isw, S1eha-aT5c7WMk7lDLsW0A, zc_ptb03jQiXnWGwmpAk0A"
130,iZE1J4HZ7CQdiL76w6vsJw,"I1j1kEbQ5BliKsjzl5etVA, nbJXmGpdCxiBnovBkBtWcA, ZOyBVpeSQ7sYDeZa_v0MFw, GbRN507iOJ6JOU-dixk-PQ, 563C7-HcjhZwZSl4fK-mfQ, b8-lt7cnQpcvHM6Qre-WZA, KMlY-L1oAL3qMQnwQCJPhQ, se9MhDAQjACYMO3LCIfT1Q, MuVIpRAEkNfRnmhsPTdl3A, MGOBNMCuhnYRcaiBj9-g1Q"
131,ZkWzMb9QbB5e3JerEIg4Fw,"LUhVj-r2TtmFx6cyF9ilJg, BmrVL3Aj5usPfpu5DE1iCg, 563C7-HcjhZwZSl4fK-mfQ, te-QMdSMQdjws6NnRexjJQ, adI5BlJCtvWq2uAwmyndXA, QMySP-qHdwQNZY0gDba0ng, FMoKoSHgitwnt_iMWm31nQ, xbCNlp2vWixy2W1WsfGv8g, V0tRCjf95FTqVJvmxdeqbQ, 0SBDr7GJAFzKECE7IIWfJA"
132,NIiI-af78NxSrdTl3mfF0w,"z57omnqRcAODGwbwMHEIyw, APN05ziH92oIox8EMxcceg, 3hjLxqqEfnBhwL6ecave_g, nJdNzQ5Z278gTCFJ4HQBLA, vL44Ky9VxUtOgteyHasRIA, vy5dhJyQ_VC1NUpPMmRUlw, 6MR9GZjWjLAS3s39YdDXKw, W-kOZ946xRWBJZvxXhJ7DA, S1eha-aT5c7WMk7lDLsW0A, pM4mWLjeaZJlcdUxut2lMg"
133,nF5jMQ2CUIiQG7U-yvFq7g,"yv8m3r2v3xQtDCYnwJa99Q, KMlY-L1oAL3qMQnwQCJPhQ, N1BTJaWnLsCVsJ3I41EPdg, sH-11zOhWubXobEeuMo2gg, APN05ziH92oIox8EMxcceg, W-kOZ946xRWBJZvxXhJ7DA, kYDkMGQEuQIeSOGZHHjIxA, F3xksTtZUfanOcLQqJn0eQ, NW3KM7K7ywzEfqk3OR4tAQ, 2vOHS-_p5ylEf0BGR1dO9w"
134,u8wr1QZT5k2maUB6_8ni-Q,"563C7-HcjhZwZSl4fK-mfQ, nJdNzQ5Z278gTCFJ4HQBLA, XahLCgicRsLPb0TSMAIQtw, hJNjKc4sKgWG__KitlJ1ag, 8axxI33rUyswfRk_v3vS0A, hz0ldhBHu5M4ri9M_mkOdQ, EiYE3T3hfqcpcficZ4zJzQ, g_fGPZJlGeKGLgC-j-tj6w, 6Kl2SQp-zGo-nsdImLykxw, xOZ7bkrttSIGS4NZm49w5Q"
135,Fou1SlEsdm7ceRTAJCSK-Q,"6MR9GZjWjLAS3s39YdDXKw, 563C7-HcjhZwZSl4fK-mfQ, aIs7Tt3pw6ymj3FOPPR4Ng, fNtFIQM_FKsHsyEIVk_KMQ, V8vKFvdrvhTrQrt-rxKrPA, GbRN507iOJ6JOU-dixk-PQ, qesu3mk5yHeak9CUO4gRdQ, OsJ6-TRuk7dDJC9EjapLiQ, _jNe_vwxiEh0G9JRZByc0w, 2HMvoTz_hw0noLzBWmyxcA"
136,7N9YwddVlZtd2NQkvx3jGQ,"z-3ZDmVbHZjDrYZE42yKZA, cgEzHZQKhi2anXfyF75MQw, hJNjKc4sKgWG__KitlJ1ag, WUAe0FGaLRCremEDXqNV4A, E7s0QreUJ2H9r0Ls1yDeiQ, vL44Ky9VxUtOgteyHasRIA, AinopkZXEBEzm7Q3vidL1w, xjBvbDmbsA0VX-vA55SbAA, 36jGZp7V0jLnPCYmRipUCg, 6MR9GZjWjLAS3s39YdDXKw"
137,RFxjYeLW_aYLdVW3PBwFNg,"Kcg5iMwYq5ibBuEhDXKx3Q, xWuzWH8qYaa75REqVd9Isw, 1X9DnaRUexCmwohV2E-f1g, se9MhDAQjACYMO3LCIfT1Q, Q0fcX_1wvdmffqEPa246rg, hJNjKc4sKgWG__KitlJ1ag, 47Uu-2MceSRFmohdzCOvGQ, 563C7-HcjhZwZSl4fK-mfQ, aIs7Tt3pw6ymj3FOPPR4Ng, KWPhAfod__yKvjH-LG4bjg"
138,w_kJSxW49eAT6NdiXJEpsw,"FMoKoSHgitwnt_iMWm31nQ, BmrVL3Aj5usPfpu5DE1iCg, gtx0OZnN98YXAASyMzv3hw, E7s0QreUJ2H9r0Ls1yDeiQ, 366NwqHwhOic5pBN1DjmDQ, aJkxkjYvi89gHIOomnjGVQ, IWNPEvd3o6GHi60MxnPCVQ, hWpHSSGx4oxxtiJuDEioFw, LUhVj-r2TtmFx6cyF9ilJg, B9gUwTS1_Yzj2vajjC7Vmg"
139,HxEgQzp1ELEBXyk9v5UF2A,"kYDkMGQEuQIeSOGZHHjIxA, P_q9rwxm-O-8cQ3xiswHHg, 2YPpmW-mpN2f6c4cFDtjPw, V8vKFvdrvhTrQrt-rxKrPA, LUhVj-r2TtmFx6cyF9ilJg, E_scgX9Vws9adbh4i_QJnQ, gtx0OZnN98YXAASyMzv3hw, W-kOZ946xRWBJZvxXhJ7DA, vCVTKIeIL55vjhWImBrpSA, hJNjKc4sKgWG__KitlJ1ag"
140,KIRUItqBI5IwFB1PWqSGzA,"lWRbdK9YABr0auLG19FHhQ, adI5BlJCtvWq2uAwmyndXA, PcR-9sTQRK_UN7qO9rzDNw, _TqUO2XaxLQ9i_z3RM8puQ, Q0fcX_1wvdmffqEPa246rg, vy5dhJyQ_VC1NUpPMmRUlw, 3hjLxqqEfnBhwL6ecave_g, dxOMcBE9P1a9vflvLR1P-Q, utYpyFOjNisHl1h7lDGSGA, 36jGZp7V0jLnPCYmRipUCg"
141,qv6zFKA9j2_YSkZ3ImUHAw,"E7s0QreUJ2H9r0Ls1yDeiQ, hz0ldhBHu5M4ri9M_mkOdQ, S1eha-aT5c7WMk7lDLsW0A, 6MR9GZjWjLAS3s39YdDXKw, 0HyuO5rOKeaa08TFzjIJIA, N8hUGYmf0jEO9eDzmYHuAw, J_KI8rJa_dSwTglUbwFcdw, yF_fqO9cUUEyaIWhb-iOQQ, L4ivYHVCDpIE0SrPaCn0LA, qesu3mk5yHeak9CUO4gRdQ"
142,2CvY-N_zMLI_WOv8HogPhw,"AUiX65HxQqwk1yvsBcbTdQ, 8PmbCVEjWGPouD1Tst6FsQ, 6MR9GZjWjLAS3s39YdDXKw, yv8m3r2v3xQtDCYnwJa99Q, LUhVj-r2TtmFx6cyF9ilJg, hz0ldhBHu5M4ri9M_mkOdQ, AEVNOYRr8ZsG1bj3NuEKgA, hJNjKc4sKgWG__KitlJ1ag, nJdNzQ5Z278gTCFJ4HQBLA, te-QMdSMQdjws6NnRexjJQ"
143,zZtSF9uCvA4-z_-j1RiyAA,"sH-11zOhWubXobEeuMo2gg, W-kOZ946xRWBJZvxXhJ7DA, r_KDxVcTZVEigYepnoJ6Lw, IWNPEvd3o6GHi60MxnPCVQ, S1eha-aT5c7WMk7lDLsW0A, T3iWl33fpg4H88zUFr-dSw, tDEdasb2r1FShg8iSzUHHQ, AUiX65HxQqwk1yvsBcbTdQ, 6Kl2SQp-zGo-nsdImLykxw, hJNjKc4sKgWG__KitlJ1ag"
144,4FUVYIUwdLkHrQZ17VV3Tg,"Kcg5iMwYq5ibBuEhDXKx3Q, z-3ZDmVbHZjDrYZE42yKZA, E7s0QreUJ2H9r0Ls1yDeiQ, cgEzHZQKhi2anXfyF75MQw, o9KcGDv2Lkbtit7mxZs8qA, nbF7bEjx_4lQJ3t6aVqFjA, W-kOZ946xRWBJZvxXhJ7DA, IWNPEvd3o6GHi60MxnPCVQ, vL44Ky9VxUtOgteyHasRIA, ksP8426d2qN-mg-JDpkRVQ"
145,XFqrwk2eyELwev8aFSxvQg,"3hjLxqqEfnBhwL6ecave_g, aIs7Tt3pw6ymj3FOPPR4Ng, nJdNzQ5Z278gTCFJ4HQBLA, S1eha-aT5c7WMk7lDLsW0A, WAMesuyxdmL3SRigsxlXng, gtx0OZnN98YXAASyMzv3hw, se9MhDAQjACYMO3LCIfT1Q, zK_6fn5ZLSkW7OhRD30IBw, N1BTJaWnLsCVsJ3I41EPdg, 36jGZp7V0jLnPCYmRipUCg"
146,Ou4BjdfuERdzcRN_tMhq4Q,"xOZ7bkrttSIGS4NZm49w5Q, lWRbdK9YABr0auLG19FHhQ, utYpyFOjNisHl1h7lDGSGA, 563C7-HcjhZwZSl4fK-mfQ, fNtFIQM_FKsHsyEIVk_KMQ, IESXUxhhaHOHvLIgLsa3aQ, e8ohWYW8rbOZWZ4pojU4zQ, 366NwqHwhOic5pBN1DjmDQ, IWNPEvd3o6GHi60MxnPCVQ, AUiX65HxQqwk1yvsBcbTdQ"
147,d0M3Bx5CfuCBMx4a6yFb2w,"EiYE3T3hfqcpcficZ4zJzQ, S1eha-aT5c7WMk7lDLsW0A, 563C7-HcjhZwZSl4fK-mfQ, csbBCysrsifg8N10c0eHCA, se9MhDAQjACYMO3LCIfT1Q, _jNe_vwxiEh0G9JRZByc0w, 6MR9GZjWjLAS3s39YdDXKw, FMoKoSHgitwnt_iMWm31nQ, z-3ZDmVbHZjDrYZE42yKZA, 7Oi6eT_-h_9JlMqRsEdt3A"
148,9-e6IZC7lv7zWVGr0kDBfw,"se9MhDAQjACYMO3LCIfT1Q, 563C7-HcjhZwZSl4fK-mfQ, z57omnqRcAODGwbwMHEIyw, Q0fcX_1wvdmffqEPa246rg, IWNPEvd3o6GHi60MxnPCVQ, AUiX65HxQqwk1yvsBcbTdQ, MuVIpRAEkNfRnmhsPTdl3A, pM4mWLjeaZJlcdUxut2lMg, sH-11zOhWubXobEeuMo2gg, qeFGUu1WPvMMNn5Hno6D-Q"
149,xuQ51kpd3TKXwYwHUysRpQ,"r_KDxVcTZVEigYepnoJ6Lw, OvbLKXkJCg8ZMHX9L5faIA, S1eha-aT5c7WMk7lDLsW0A, E7s0QreUJ2H9r0Ls1yDeiQ, 85Y24Itl548cCCVV2d8HxQ, se9MhDAQjACYMO3LCIfT1Q, x1bjSvpIJTN1KBFhUjOU_g, PaH33N0LI-qitEtS9aMKxg, gtx0OZnN98YXAASyMzv3hw, 366NwqHwhOic5pBN1DjmDQ"
150,Et6mwzOORak5K6kJ-yw4Xw,"Jwp4UFa93ENe-0REPo5hCQ, Q0fcX_1wvdmffqEPa246rg, lWRbdK9YABr0auLG19FHhQ, XahLCgicRsLPb0TSMAIQtw, q9hS_e29155kfo_SeIT1Mw, xjBvbDmbsA0VX-vA55SbAA, _jNe_vwxiEh0G9JRZByc0w, cgEzHZQKhi2anXfyF75MQw, Rx85NUdD6MhrgKxHr05NlQ, 6MR9GZjWjLAS3s39YdDXKw"
151,YBtA8qWOVU0Jee8g_jAXEQ,"csbBCysrsifg8N10c0eHCA, 6Kl2SQp-zGo-nsdImLykxw, cgEzHZQKhi2anXfyF75MQw, xWuzWH8qYaa75REqVd9Isw, tD1veHsKELAH3b7wKmHsaw, DdfvQ1hZOB0-ra7pu-wwoA, xjBvbDmbsA0VX-vA55SbAA, 2vOHS-_p5ylEf0BGR1dO9w, APN05ziH92oIox8EMxcceg, nJdNzQ5Z278gTCFJ4HQBLA"
152,N5EqlX0a8Hu6vheBMgTtDA,"nJdNzQ5Z278gTCFJ4HQBLA, qeFGUu1WPvMMNn5Hno6D-Q, pM4mWLjeaZJlcdUxut2lMg, xbCNlp2vWixy2W1WsfGv8g, srBBM1JiO9wo1OAHieBu-w, K8D_ltZWGvdXUaSE7bBiDw, MxHZ5XwIQWnJFTw9gZxAIg, KMlY-L1oAL3qMQnwQCJPhQ, S9XKKA1evhRh16zrXpSF7g, xWuzWH8qYaa75REqVd9Isw"
153,xA78hV3BVAycTmVIm3pU-w,"nJdNzQ5Z278gTCFJ4HQBLA, z57omnqRcAODGwbwMHEIyw, 563C7-HcjhZwZSl4fK-mfQ, L4ivYHVCDpIE0SrPaCn0LA, e8ohWYW8rbOZWZ4pojU4zQ, FMoKoSHgitwnt_iMWm31nQ, 6MR9GZjWjLAS3s39YdDXKw, zc_ptb03jQiXnWGwmpAk0A, xbCNlp2vWixy2W1WsfGv8g, ZOyBVpeSQ7sYDeZa_v0MFw"
154,q7afpu276gtNdGDWaGqn0g,"K8D_ltZWGvdXUaSE7bBiDw, KMlY-L1oAL3qMQnwQCJPhQ, S1eha-aT5c7WMk7lDLsW0A, gqsU03i-WiyYHcBCdwObuQ, 47Uu-2MceSRFmohdzCOvGQ, se9MhDAQjACYMO3LCIfT1Q, B9gUwTS1_Yzj2vajjC7Vmg, xbCNlp2vWixy2W1WsfGv8g, GbRN507iOJ6JOU-dixk-PQ, rvOvog5Utw3VXBwiSCAl0A"
155,U1L1ZTbrFOu9kdxa1A2cgg,"PiT0jyLL2Jwm2ODTDapOcg, E_scgX9Vws9adbh4i_QJnQ, sjrTFzrb7_pzzBEpC-BvpA, 0SBDr7GJAFzKECE7IIWfJA, z57omnqRcAODGwbwMHEIyw, utYpyFOjNisHl1h7lDGSGA, sH-11zOhWubXobEeuMo2gg, kYDkMGQEuQIeSOGZHHjIxA, DdfvQ1hZOB0-ra7pu-wwoA, J_KI8rJa_dSwTglUbwFcdw"
156,eJpAIofn1vugSg-h57gPrQ,"cgEzHZQKhi2anXfyF75MQw, E7s0QreUJ2H9r0Ls1yDeiQ, KWPhAfod__yKvjH-LG4bjg, IWNPEvd3o6GHi60MxnPCVQ, hJNjKc4sKgWG__KitlJ1ag, gtx0OZnN98YXAASyMzv3hw, Kcg5iMwYq5ibBuEhDXKx3Q, zK_6fn5ZLSkW7OhRD30IBw, z-3ZDmVbHZjDrYZE42yKZA, PiT0jyLL2Jwm2ODTDapOcg"
157,LGfDJMfXDDj93YUfrEqEhA,"PcR-9sTQRK_UN7qO9rzDNw, V0tRCjf95FTqVJvmxdeqbQ, bMEZKjo5LTZS3Hk7zGKflQ, z57omnqRcAODGwbwMHEIyw, N8hUGYmf0jEO9eDzmYHuAw, 563C7-HcjhZwZSl4fK-mfQ, QMySP-qHdwQNZY0gDba0ng, xbCNlp2vWixy2W1WsfGv8g, 8PmbCVEjWGPouD1Tst6FsQ, se9MhDAQjACYMO3LCIfT1Q"
158,ccHzPfXNuczHUnE50xorTA,"8PmbCVEjWGPouD1Tst6FsQ, E7s0QreUJ2H9r0Ls1yDeiQ, hJNjKc4sKgWG__KitlJ1ag, E_scgX9Vws9adbh4i_QJnQ, PiT0jyLL2Jwm2ODTDapOcg, Q0fcX_1wvdmffqEPa246rg, vL44Ky9VxUtOgteyHasRIA, F3xksTtZUfanOcLQqJn0eQ, Vtahv3Af90H3fUuEEhPhdQ, se9MhDAQjACYMO3LCIfT1Q"
159,Adg7wTKXnMxCERIQ1tv8fg,"47Uu-2MceSRFmohdzCOvGQ, nJdNzQ5Z278gTCFJ4HQBLA, N1BTJaWnLsCVsJ3I41EPdg, pM4mWLjeaZJlcdUxut2lMg, B9gUwTS1_Yzj2vajjC7Vmg, K8D_ltZWGvdXUaSE7bBiDw, 366NwqHwhOic5pBN1DjmDQ, KtUuxN2gZXeC7WpJ_w9hNg, FMoKoSHgitwnt_iMWm31nQ, 563C7-HcjhZwZSl4fK-mfQ"
160,PqfTIt852IueKvvewNCW4g,"rvOvog5Utw3VXBwiSCAl0A, qeFGUu1WPvMMNn5Hno6D-Q, Q0fcX_1wvdmffqEPa246rg, se9MhDAQjACYMO3LCIfT1Q, HpgBVYnLQRRBPLxEdGe1Hg, 563C7-HcjhZwZSl4fK-mfQ, xWuzWH8qYaa75REqVd9Isw, 0HyuO5rOKeaa08TFzjIJIA, Rx85NUdD6MhrgKxHr05NlQ, xjBvbDmbsA0VX-vA55SbAA"
161,-K78Uw-3Z_Ph0JCx0FXNig,"hJNjKc4sKgWG__KitlJ1ag, pM4mWLjeaZJlcdUxut2lMg, Q0fcX_1wvdmffqEPa246rg, xWuzWH8qYaa75REqVd9Isw, E7s0QreUJ2H9r0Ls1yDeiQ, _jNe_vwxiEh0G9JRZByc0w, AUiX65HxQqwk1yvsBcbTdQ, gtx0OZnN98YXAASyMzv3hw, sH-11zOhWubXobEeuMo2gg, xbCNlp2vWixy2W1WsfGv8g"
162,t_mhu4-BWlTamg9KbGU91w,"EKEPtNKJdZxRhYoFhuG8ew, BmrVL3Aj5usPfpu5DE1iCg, 563C7-HcjhZwZSl4fK-mfQ, Q0fcX_1wvdmffqEPa246rg, E7s0QreUJ2H9r0Ls1yDeiQ, _TqUO2XaxLQ9i_z3RM8puQ, hJNjKc4sKgWG__KitlJ1ag, gtx0OZnN98YXAASyMzv3hw, qeFGUu1WPvMMNn5Hno6D-Q, hz0ldhBHu5M4ri9M_mkOdQ"
163,KaU3rrZ-MP1KRfOyTbBD1A,"Vtahv3Af90H3fUuEEhPhdQ, adI5BlJCtvWq2uAwmyndXA, E7s0QreUJ2H9r0Ls1yDeiQ, 3hjLxqqEfnBhwL6ecave_g, hJNjKc4sKgWG__KitlJ1ag, vL44Ky9VxUtOgteyHasRIA, RiPhiTDvmhqlF9BYWv8mtA, z57omnqRcAODGwbwMHEIyw, 563C7-HcjhZwZSl4fK-mfQ, 6MR9GZjWjLAS3s39YdDXKw"
164,bFuvgmxqql2KRj56bHmIZQ,"8axxI33rUyswfRk_v3vS0A, Q0fcX_1wvdmffqEPa246rg, te-QMdSMQdjws6NnRexjJQ, 6MR9GZjWjLAS3s39YdDXKw, xjBvbDmbsA0VX-vA55SbAA, Kcg5iMwYq5ibBuEhDXKx3Q, BmrVL3Aj5usPfpu5DE1iCg, csbBCysrsifg8N10c0eHCA, Jwp4UFa93ENe-0REPo5hCQ, 563C7-HcjhZwZSl4fK-mfQ"
165,rBHZxhzDiZR2gCFoEgGRpQ,"MuVIpRAEkNfRnmhsPTdl3A, V8vKFvdrvhTrQrt-rxKrPA, vy5dhJyQ_VC1NUpPMmRUlw, WUAe0FGaLRCremEDXqNV4A, Vtahv3Af90H3fUuEEhPhdQ, 6MR9GZjWjLAS3s39YdDXKw, 2vOHS-_p5ylEf0BGR1dO9w, 8axxI33rUyswfRk_v3vS0A, wNy3CnWWAnTCfDYsZTSUPw, 563C7-HcjhZwZSl4fK-mfQ"
166,ccIa9Xj2r8lFnYB7seE5LA,"563C7-HcjhZwZSl4fK-mfQ, PcR-9sTQRK_UN7qO9rzDNw, sjrTFzrb7_pzzBEpC-BvpA, KMlY-L1oAL3qMQnwQCJPhQ, rvOvog5Utw3VXBwiSCAl0A, gqsU03i-WiyYHcBCdwObuQ, Q1XCsLlyXZJU0ZjuVCcM4A, _jNe_vwxiEh0G9JRZByc0w, Vtahv3Af90H3fUuEEhPhdQ, hJNjKc4sKgWG__KitlJ1ag"
167,wbYenlOjoHtEfYUZ28l6yQ,"S1eha-aT5c7WMk7lDLsW0A, J_KI8rJa_dSwTglUbwFcdw, GbRN507iOJ6JOU-dixk-PQ, z57omnqRcAODGwbwMHEIyw, xOZ7bkrttSIGS4NZm49w5Q, FMoKoSHgitwnt_iMWm31nQ, vL44Ky9VxUtOgteyHasRIA, oAsjdHwXgKtK-NU_JEYuPg, W-kOZ946xRWBJZvxXhJ7DA, S9XKKA1evhRh16zrXpSF7g"
168,Demry6BFAChyZsIicv5EbQ,"V8vKFvdrvhTrQrt-rxKrPA, z-3ZDmVbHZjDrYZE42yKZA, 2HMvoTz_hw0noLzBWmyxcA, 563C7-HcjhZwZSl4fK-mfQ, xbCNlp2vWixy2W1WsfGv8g, 2vOHS-_p5ylEf0BGR1dO9w, zc_ptb03jQiXnWGwmpAk0A, hz0ldhBHu5M4ri9M_mkOdQ, vL44Ky9VxUtOgteyHasRIA, LUhVj-r2TtmFx6cyF9ilJg"
169,oN9bug-cjYV5XfAXkUkDZQ,"s7TMkWF36dwwD8R3TKsJqw, xWuzWH8qYaa75REqVd9Isw, V8vKFvdrvhTrQrt-rxKrPA, 563C7-HcjhZwZSl4fK-mfQ, z57omnqRcAODGwbwMHEIyw, xbCNlp2vWixy2W1WsfGv8g, xOZ7bkrttSIGS4NZm49w5Q, 2vOHS-_p5ylEf0BGR1dO9w, qeFGUu1WPvMMNn5Hno6D-Q, FMoKoSHgitwnt_iMWm31nQ"
170,F__GQ51ECBWekNnIxJT0AQ,"366NwqHwhOic5pBN1DjmDQ, EiYE3T3hfqcpcficZ4zJzQ, KMlY-L1oAL3qMQnwQCJPhQ, zK_6fn5ZLSkW7OhRD30IBw, 563C7-HcjhZwZSl4fK-mfQ, xOZ7bkrttSIGS4NZm49w5Q, Sagzs4cd0ruWEK_T9DaFHg, csbBCysrsifg8N10c0eHCA, 2vOHS-_p5ylEf0BGR1dO9w, E7s0QreUJ2H9r0Ls1yDeiQ"
171,nHIUbyU_XZnFtdi3-oymXA,"sH-11zOhWubXobEeuMo2gg, V0tRCjf95FTqVJvmxdeqbQ, 563C7-HcjhZwZSl4fK-mfQ, FMoKoSHgitwnt_iMWm31nQ, aIs7Tt3pw6ymj3FOPPR4Ng, K8D_ltZWGvdXUaSE7bBiDw, BmrVL3Aj5usPfpu5DE1iCg, 366NwqHwhOic5pBN1DjmDQ, AUiX65HxQqwk1yvsBcbTdQ, rvOvog5Utw3VXBwiSCAl0A"
172,hS5B81QZp24M-9m8lDBv0A,"Rx85NUdD6MhrgKxHr05NlQ, Q0fcX_1wvdmffqEPa246rg, AUiX65HxQqwk1yvsBcbTdQ, 563C7-HcjhZwZSl4fK-mfQ, r_KDxVcTZVEigYepnoJ6Lw, z57omnqRcAODGwbwMHEIyw, cgEzHZQKhi2anXfyF75MQw, 8axxI33rUyswfRk_v3vS0A, 2HMvoTz_hw0noLzBWmyxcA, lWRbdK9YABr0auLG19FHhQ"
173,ltJ6UR7deTWoPMej1AW2jQ,"BmrVL3Aj5usPfpu5DE1iCg, cgEzHZQKhi2anXfyF75MQw, e8ohWYW8rbOZWZ4pojU4zQ, _TqUO2XaxLQ9i_z3RM8puQ, S1eha-aT5c7WMk7lDLsW0A, qeFGUu1WPvMMNn5Hno6D-Q, se9MhDAQjACYMO3LCIfT1Q, 0SBDr7GJAFzKECE7IIWfJA, 0HyuO5rOKeaa08TFzjIJIA, 563C7-HcjhZwZSl4fK-mfQ"
174,8UgMUgkhCh3HwB0x7YgxqQ,"r3U-3yOP1ZB8Yu8Gv0Auwg, I1j1kEbQ5BliKsjzl5etVA, 563C7-HcjhZwZSl4fK-mfQ, J_KI8rJa_dSwTglUbwFcdw, BmrVL3Aj5usPfpu5DE1iCg, 0SBDr7GJAFzKECE7IIWfJA, tD1veHsKELAH3b7wKmHsaw, 0HyuO5rOKeaa08TFzjIJIA, FMoKoSHgitwnt_iMWm31nQ, cgEzHZQKhi2anXfyF75MQw"
175,X4qXP6G0GBz1y5bDUafYrQ,"yv8m3r2v3xQtDCYnwJa99Q, r3U-3yOP1ZB8Yu8Gv0Auwg, adI5BlJCtvWq2uAwmyndXA, vy5dhJyQ_VC1NUpPMmRUlw, qesu3mk5yHeak9CUO4gRdQ, ksP8426d2qN-mg-JDpkRVQ, PiT0jyLL2Jwm2ODTDapOcg, L4ivYHVCDpIE0SrPaCn0LA, F3xksTtZUfanOcLQqJn0eQ, 1X9DnaRUexCmwohV2E-f1g"
176,pSfeno8ExPHvn8NXca5sfA,"563C7-HcjhZwZSl4fK-mfQ, _TqUO2XaxLQ9i_z3RM8puQ, se9MhDAQjACYMO3LCIfT1Q, Q0fcX_1wvdmffqEPa246rg, E8PkjCmDnDE7_2rYf38lRA, Rx85NUdD6MhrgKxHr05NlQ, HcfwrlljJpfLh71znq47zw, KL1oif2ocGH2dJ4w-oT_Mg, utYpyFOjNisHl1h7lDGSGA, 3hjLxqqEfnBhwL6ecave_g"
177,awto1-gW36q0avBVDGf_1g,"Rx85NUdD6MhrgKxHr05NlQ, z57omnqRcAODGwbwMHEIyw, gONO6UIMj8kFo1IvnROuuQ, DdfvQ1hZOB0-ra7pu-wwoA, APN05ziH92oIox8EMxcceg, nbJXmGpdCxiBnovBkBtWcA, se9MhDAQjACYMO3LCIfT1Q, e8ohWYW8rbOZWZ4pojU4zQ, xWuzWH8qYaa75REqVd9Isw, _TqUO2XaxLQ9i_z3RM8puQ"
178,QcwinI60dFY5nd7ZwXZphA,"2HMvoTz_hw0noLzBWmyxcA, IWNPEvd3o6GHi60MxnPCVQ, vL44Ky9VxUtOgteyHasRIA, nJdNzQ5Z278gTCFJ4HQBLA, W-kOZ946xRWBJZvxXhJ7DA, E7s0QreUJ2H9r0Ls1yDeiQ, GS06uO84yKQpa7oezgVZgQ, PiT0jyLL2Jwm2ODTDapOcg, LUhVj-r2TtmFx6cyF9ilJg, adI5BlJCtvWq2uAwmyndXA"
179,-ZBReTMh4DEGjc9XtteCtg,"xEBRgLnqQ9bYkxTyyR3MNQ, hJNjKc4sKgWG__KitlJ1ag, 8axxI33rUyswfRk_v3vS0A, z57omnqRcAODGwbwMHEIyw, QMySP-qHdwQNZY0gDba0ng, VDQPizXm5NcxYHcBQbzdGw, F3xksTtZUfanOcLQqJn0eQ, 1rVolOOpyyqcy5w366lMqw, 8Haoz9Mil7ZnHGU48sgBtw, Rx85NUdD6MhrgKxHr05NlQ"
180,mBcFST0p0wFnqYUGjtZ4lg,"se9MhDAQjACYMO3LCIfT1Q, 6MR9GZjWjLAS3s39YdDXKw, x1bjSvpIJTN1KBFhUjOU_g, EKEPtNKJdZxRhYoFhuG8ew, 563C7-HcjhZwZSl4fK-mfQ, hJNjKc4sKgWG__KitlJ1ag, MuVIpRAEkNfRnmhsPTdl3A, xWuzWH8qYaa75REqVd9Isw, BmrVL3Aj5usPfpu5DE1iCg, Vtahv3Af90H3fUuEEhPhdQ"
181,xux7pwny7edNxhUmPPpFkg,"hJNjKc4sKgWG__KitlJ1ag, 563C7-HcjhZwZSl4fK-mfQ, FMoKoSHgitwnt_iMWm31nQ, Q0fcX_1wvdmffqEPa246rg, MuVIpRAEkNfRnmhsPTdl3A, cgEzHZQKhi2anXfyF75MQw, se9MhDAQjACYMO3LCIfT1Q, _TqUO2XaxLQ9i_z3RM8puQ, q9hS_e29155kfo_SeIT1Mw, APN05ziH92oIox8EMxcceg"
182,93vyTaJgzQRQO4Zs9Cg_pw,"nJdNzQ5Z278gTCFJ4HQBLA, 3hjLxqqEfnBhwL6ecave_g, 8Haoz9Mil7ZnHGU48sgBtw, se9MhDAQjACYMO3LCIfT1Q, 366NwqHwhOic5pBN1DjmDQ, nbF7bEjx_4lQJ3t6aVqFjA, hJNjKc4sKgWG__KitlJ1ag, W-kOZ946xRWBJZvxXhJ7DA, UqcK-YuHPzcWQtNjmhTb7g, aHYIubjRbTLB3o_eXkrMXA"
183,fQKue8ExT7MGxFcaxBWAIQ,"WtvDGvduFU-IH1qxrZNcJQ, 2HMvoTz_hw0noLzBWmyxcA, z-3ZDmVbHZjDrYZE42yKZA, DdfvQ1hZOB0-ra7pu-wwoA, kMRYwa1IOb-WJzDW-Cqdhw, IO8J6QJsdFeuso1Xmp3YtA, sH-11zOhWubXobEeuMo2gg, vy5dhJyQ_VC1NUpPMmRUlw, QMySP-qHdwQNZY0gDba0ng, PiT0jyLL2Jwm2ODTDapOcg"
184,HYJUTUxMzyLyniE5tFoE-g,"563C7-HcjhZwZSl4fK-mfQ, z57omnqRcAODGwbwMHEIyw, nbF7bEjx_4lQJ3t6aVqFjA, yYh6t6a_0LGLVS_MNYEHsQ, Vtahv3Af90H3fUuEEhPhdQ, lrPNLw0zbfzgWrWINMjsNw, FMoKoSHgitwnt_iMWm31nQ, EKEPtNKJdZxRhYoFhuG8ew, xOZ7bkrttSIGS4NZm49w5Q, sH-11zOhWubXobEeuMo2gg"
185,fac2ymxeYW7tu6ysUGzaNw,"nJdNzQ5Z278gTCFJ4HQBLA, 8axxI33rUyswfRk_v3vS0A, s7TMkWF36dwwD8R3TKsJqw, tD1veHsKELAH3b7wKmHsaw, V8vKFvdrvhTrQrt-rxKrPA, 563C7-HcjhZwZSl4fK-mfQ, xjBvbDmbsA0VX-vA55SbAA, xOZ7bkrttSIGS4NZm49w5Q, 85Y24Itl548cCCVV2d8HxQ, hJNjKc4sKgWG__KitlJ1ag"
186,bwS0UtV5XH-5BnkKdflyIg,"3hjLxqqEfnBhwL6ecave_g, BmrVL3Aj5usPfpu5DE1iCg, D2smJ2r0RrVoe0aGlT-2wA, Fppy5re0jwpdHcRVRPlBOw, cBHMUESPj4SNs65Xv6xWRA, x1bjSvpIJTN1KBFhUjOU_g, GbRN507iOJ6JOU-dixk-PQ, 47Uu-2MceSRFmohdzCOvGQ, 8axxI33rUyswfRk_v3vS0A, AUiX65HxQqwk1yvsBcbTdQ"
187,aLyUjrk69wzNe8828nmwvA,"pM4mWLjeaZJlcdUxut2lMg, 3hjLxqqEfnBhwL6ecave_g, 563C7-HcjhZwZSl4fK-mfQ, QMySP-qHdwQNZY0gDba0ng, z-3ZDmVbHZjDrYZE42yKZA, 47Uu-2MceSRFmohdzCOvGQ, 6MR9GZjWjLAS3s39YdDXKw, Vtahv3Af90H3fUuEEhPhdQ, S1eha-aT5c7WMk7lDLsW0A, LUhVj-r2TtmFx6cyF9ilJg"
188,mgqLOj2fYPriJwfpx1bEWA,"FMoKoSHgitwnt_iMWm31nQ, z57omnqRcAODGwbwMHEIyw, xOZ7bkrttSIGS4NZm49w5Q, J_KI8rJa_dSwTglUbwFcdw, gONO6UIMj8kFo1IvnROuuQ, s7TMkWF36dwwD8R3TKsJqw, sgawLt-htNEwUh8Wmp3hHQ, gqsU03i-WiyYHcBCdwObuQ, csbBCysrsifg8N10c0eHCA, qeFGUu1WPvMMNn5Hno6D-Q"
189,_AkImqSimksxIDIVq4V-dA,"e8ohWYW8rbOZWZ4pojU4zQ, z57omnqRcAODGwbwMHEIyw, 563C7-HcjhZwZSl4fK-mfQ, vL44Ky9VxUtOgteyHasRIA, 2vOHS-_p5ylEf0BGR1dO9w, cgEzHZQKhi2anXfyF75MQw, L4ivYHVCDpIE0SrPaCn0LA, xOZ7bkrttSIGS4NZm49w5Q, g_fGPZJlGeKGLgC-j-tj6w, EiYE3T3hfqcpcficZ4zJzQ"
190,QLecW-87QIdnwBnVH1mDBQ,"563C7-HcjhZwZSl4fK-mfQ, AUiX65HxQqwk1yvsBcbTdQ, S1eha-aT5c7WMk7lDLsW0A, vL44Ky9VxUtOgteyHasRIA, se9MhDAQjACYMO3LCIfT1Q, E7s0QreUJ2H9r0Ls1yDeiQ, 85Y24Itl548cCCVV2d8HxQ, xWuzWH8qYaa75REqVd9Isw, b8-lt7cnQpcvHM6Qre-WZA, 2vOHS-_p5ylEf0BGR1dO9w"
191,sZ7Yj68IqrPXVSs0hsfUJg,"563C7-HcjhZwZSl4fK-mfQ, AUiX65HxQqwk1yvsBcbTdQ, se9MhDAQjACYMO3LCIfT1Q, Q0fcX_1wvdmffqEPa246rg, z57omnqRcAODGwbwMHEIyw, nJdNzQ5Z278gTCFJ4HQBLA, nbJXmGpdCxiBnovBkBtWcA, Fx4ONDdL_3eM-KCQ49WUSQ, E8PkjCmDnDE7_2rYf38lRA, _TqUO2XaxLQ9i_z3RM8puQ"
192,Kmq1ggxmcd-gdY6imsrfww,"z57omnqRcAODGwbwMHEIyw, xjBvbDmbsA0VX-vA55SbAA, voaZjLwStQEq9-wj7hFYBQ, FMoKoSHgitwnt_iMWm31nQ, yv8m3r2v3xQtDCYnwJa99Q, 0SBDr7GJAFzKECE7IIWfJA, kYDkMGQEuQIeSOGZHHjIxA, 36jGZp7V0jLnPCYmRipUCg, cgEzHZQKhi2anXfyF75MQw, z-3ZDmVbHZjDrYZE42yKZA"
