number,user,restaurant_names
1,yfXqZkU5iXE07GSHzdsQBA,"z-3ZDmVbHZjDrYZE42yKZA, xbCNlp2vWixy2W1WsfGv8g, EKEPtNKJdZxRhYoFhuG8ew, 8PmbCVEjWGPouD1Tst6FsQ, V0tRCjf95FTqVJvmxdeqbQ, QMySP-qHdwQNZY0gDba0ng, E7s0QreUJ2H9r0Ls1yDeiQ, Q0fcX_1wvdmffqEPa246rg, _jNe_vwxiEh0G9JRZByc0w, r3U-3yOP1ZB8Yu8Gv0Auwg"
2,hutJzKEYHuVq6CP-XSARgg,"adI5BlJCtvWq2uAwmyndXA, hJNjKc4sKgWG__KitlJ1ag, aIs7Tt3pw6ymj3FOPPR4Ng, 5Iin0tl6QJT_TyL1BldtyA, QMySP-qHdwQNZY0gDba0ng, sxuEde0_sVFY-Uk9gpHy_g, 36jGZp7V0jLnPCYmRipUCg, Q0fcX_1wvdmffqEPa246rg, xWuzWH8qYaa75REqVd9Isw, BmrVL3Aj5usPfpu5DE1iCg"
3,2UkZKQBZVuroUBKYs9WzeQ,"Q0fcX_1wvdmffqEPa246rg, I1j1kEbQ5BliKsjzl5etVA, BmrVL3Aj5usPfpu5DE1iCg, KL1oif2ocGH2dJ4w-oT_Mg, xbCNlp2vWixy2W1WsfGv8g, xWuzWH8qYaa75REqVd9Isw, J_KI8rJa_dSwTglUbwFcdw, 563C7-HcjhZwZSl4fK-mfQ, JOqWln_EB_f6RUSTxl04dQ, Rx85NUdD6MhrgKxHr05NlQ"
4,hihNuqYNKDwAwHeGNURE_g,"DlnMwCDIxQ-o5kNMAfOs1g, ZMcd7w-yDhFRLSwvJBV1VQ, ZOyBVpeSQ7sYDeZa_v0MFw, Q0fcX_1wvdmffqEPa246rg, 6MR9GZjWjLAS3s39YdDXKw, I1j1kEbQ5BliKsjzl5etVA, lWRbdK9YABr0auLG19FHhQ, zc_ptb03jQiXnWGwmpAk0A, sH-11zOhWubXobEeuMo2gg, MxHZ5XwIQWnJFTw9gZxAIg"
5,fmpcYRlirLlHuH_R7U-mew,"pM4mWLjeaZJlcdUxut2lMg, LUhVj-r2TtmFx6cyF9ilJg, Vtahv3Af90H3fUuEEhPhdQ, aHYIubjRbTLB3o_eXkrMXA, tuucCa40AmTMUEVNerGe9w, adI5BlJCtvWq2uAwmyndXA, gtx0OZnN98YXAASyMzv3hw, xbCNlp2vWixy2W1WsfGv8g, 563C7-HcjhZwZSl4fK-mfQ, oehWJ_dAlzU9C65b7zzKbQ"
6,B3DNjsZ3gRRsWYro4auztg,"FMoKoSHgitwnt_iMWm31nQ, 563C7-HcjhZwZSl4fK-mfQ, _TqUO2XaxLQ9i_z3RM8puQ, xOZ7bkrttSIGS4NZm49w5Q, B9gUwTS1_Yzj2vajjC7Vmg, z57omnqRcAODGwbwMHEIyw, QMySP-qHdwQNZY0gDba0ng, se9MhDAQjACYMO3LCIfT1Q, BTDPN3hMRrENFZNb76lPKw, nJdNzQ5Z278gTCFJ4HQBLA"
7,fuCGYSGs4gfeSJ9hc3xiug,"Q0fcX_1wvdmffqEPa246rg, xOZ7bkrttSIGS4NZm49w5Q, R79Hir871EF-kRLIBPy9qg, hJNjKc4sKgWG__KitlJ1ag, nbJXmGpdCxiBnovBkBtWcA, KMlY-L1oAL3qMQnwQCJPhQ, se9MhDAQjACYMO3LCIfT1Q, xbCNlp2vWixy2W1WsfGv8g, e8ohWYW8rbOZWZ4pojU4zQ, yYh6t6a_0LGLVS_MNYEHsQ"
8,eFqg1qaOBHq_Od6fRlMcWA,"S1eha-aT5c7WMk7lDLsW0A, xjBvbDmbsA0VX-vA55SbAA, 563C7-HcjhZwZSl4fK-mfQ, se9MhDAQjACYMO3LCIfT1Q, Sqwa2aNwnqCmc95gVWQ9bA, nJdNzQ5Z278gTCFJ4HQBLA, WUAe0FGaLRCremEDXqNV4A, lWRbdK9YABr0auLG19FHhQ, z-3ZDmVbHZjDrYZE42yKZA, 8PmbCVEjWGPouD1Tst6FsQ"
9,KvFQ5iAir60bO-ZyaXwb-w,"E7s0QreUJ2H9r0Ls1yDeiQ, se9MhDAQjACYMO3LCIfT1Q, 8PmbCVEjWGPouD1Tst6FsQ, qmcIsZjLpxd0V4RekSozmA, KMlY-L1oAL3qMQnwQCJPhQ, vy5dhJyQ_VC1NUpPMmRUlw, vL44Ky9VxUtOgteyHasRIA, WUAe0FGaLRCremEDXqNV4A, l_tk3iLmyKfBUCK-6nBbHg, 47Uu-2MceSRFmohdzCOvGQ"
10,1-UXAFmZILDj_orrac7GPA,"563C7-HcjhZwZSl4fK-mfQ, ZMcd7w-yDhFRLSwvJBV1VQ, 366NwqHwhOic5pBN1DjmDQ, E7s0QreUJ2H9r0Ls1yDeiQ, voaZjLwStQEq9-wj7hFYBQ, mVZoin0a8uTZgLsgJ9iNDQ, GdzCnx5OWURyklzTjaQIPw, APN05ziH92oIox8EMxcceg, GbRN507iOJ6JOU-dixk-PQ, AEVNOYRr8ZsG1bj3NuEKgA"
11,SG9gzOvhFXjTnmZD6IEV1w,"2HMvoTz_hw0noLzBWmyxcA, se9MhDAQjACYMO3LCIfT1Q, 3hjLxqqEfnBhwL6ecave_g, mVZoin0a8uTZgLsgJ9iNDQ, 9XFW6HnKTrGv1CBY8B4zJw, 366NwqHwhOic5pBN1DjmDQ, nJdNzQ5Z278gTCFJ4HQBLA, 563C7-HcjhZwZSl4fK-mfQ, nbJXmGpdCxiBnovBkBtWcA, AUiX65HxQqwk1yvsBcbTdQ"
12,bcxcQhp0sKYd9eUnEVUzPA,"3hjLxqqEfnBhwL6ecave_g, 47Uu-2MceSRFmohdzCOvGQ, aIs7Tt3pw6ymj3FOPPR4Ng, 5Iin0tl6QJT_TyL1BldtyA, hz0ldhBHu5M4ri9M_mkOdQ, 8axxI33rUyswfRk_v3vS0A, xbCNlp2vWixy2W1WsfGv8g, V0tRCjf95FTqVJvmxdeqbQ, Kcg5iMwYq5ibBuEhDXKx3Q, 36jGZp7V0jLnPCYmRipUCg"
13,P8qK9bvWta-kDCT0NUyx4g,"2HMvoTz_hw0noLzBWmyxcA, S1eha-aT5c7WMk7lDLsW0A, gqsU03i-WiyYHcBCdwObuQ, xbCNlp2vWixy2W1WsfGv8g, s7TMkWF36dwwD8R3TKsJqw, FMoKoSHgitwnt_iMWm31nQ, MxHZ5XwIQWnJFTw9gZxAIg, xOZ7bkrttSIGS4NZm49w5Q, Rx85NUdD6MhrgKxHr05NlQ, qeFGUu1WPvMMNn5Hno6D-Q"
14,ZpO7BzOM2vmZcUW_m8H2KA,"563C7-HcjhZwZSl4fK-mfQ, QMySP-qHdwQNZY0gDba0ng, kYDkMGQEuQIeSOGZHHjIxA, yv8m3r2v3xQtDCYnwJa99Q, 36jGZp7V0jLnPCYmRipUCg, N1BTJaWnLsCVsJ3I41EPdg, csbBCysrsifg8N10c0eHCA, sH-11zOhWubXobEeuMo2gg, APN05ziH92oIox8EMxcceg, EKEPtNKJdZxRhYoFhuG8ew"
15,xXQTdJXPGOP-NUYctcQw8g,"xjBvbDmbsA0VX-vA55SbAA, 8PmbCVEjWGPouD1Tst6FsQ, 563C7-HcjhZwZSl4fK-mfQ, 3UqJKEDIh7o0aTtVUo187Q, S1eha-aT5c7WMk7lDLsW0A, se9MhDAQjACYMO3LCIfT1Q, K8D_ltZWGvdXUaSE7bBiDw, E7s0QreUJ2H9r0Ls1yDeiQ, z57omnqRcAODGwbwMHEIyw, aIs7Tt3pw6ymj3FOPPR4Ng"
16,CxIsFTy1uWhLJkJaxZQnLg,"8axxI33rUyswfRk_v3vS0A, 2vOHS-_p5ylEf0BGR1dO9w, I1j1kEbQ5BliKsjzl5etVA, 8PmbCVEjWGPouD1Tst6FsQ, APN05ziH92oIox8EMxcceg, XahLCgicRsLPb0TSMAIQtw, xWuzWH8qYaa75REqVd9Isw, hJNjKc4sKgWG__KitlJ1ag, lWRbdK9YABr0auLG19FHhQ, xbCNlp2vWixy2W1WsfGv8g"
17,SXTh-cBuiwUAaaI4hw-bcA,"2HMvoTz_hw0noLzBWmyxcA, rvOvog5Utw3VXBwiSCAl0A, 54JEijqDAJF94WF0BfYO-Q, KWPhAfod__yKvjH-LG4bjg, _jNe_vwxiEh0G9JRZByc0w, 6MR9GZjWjLAS3s39YdDXKw, _TqUO2XaxLQ9i_z3RM8puQ, 563C7-HcjhZwZSl4fK-mfQ, se9MhDAQjACYMO3LCIfT1Q, Q0fcX_1wvdmffqEPa246rg"
18,yb8_BHHcO6DBLDYX0LEKnw,"KMlY-L1oAL3qMQnwQCJPhQ, IYdv6RxSiqz2XMsqkiTmPQ, se9MhDAQjACYMO3LCIfT1Q, BmrVL3Aj5usPfpu5DE1iCg, _jNe_vwxiEh0G9JRZByc0w, S1eha-aT5c7WMk7lDLsW0A, -FQHy8Fkk-YPCoMHsRoZdg, UtdL02pH7TdKSTdAZXOu8Q, W-kOZ946xRWBJZvxXhJ7DA, hz0ldhBHu5M4ri9M_mkOdQ"
19,NIwD0clhd0rAgCOOUeLoFQ,"LUhVj-r2TtmFx6cyF9ilJg, adI5BlJCtvWq2uAwmyndXA, 8PmbCVEjWGPouD1Tst6FsQ, vy5dhJyQ_VC1NUpPMmRUlw, V8vKFvdrvhTrQrt-rxKrPA, WtvDGvduFU-IH1qxrZNcJQ, PiT0jyLL2Jwm2ODTDapOcg, XarxHcmxyjvhzoROMTLyMg, z-3ZDmVbHZjDrYZE42yKZA, vL44Ky9VxUtOgteyHasRIA"
20,NwVyki35xOcaxhMzHNtHDQ,"WUAe0FGaLRCremEDXqNV4A, se9MhDAQjACYMO3LCIfT1Q, 563C7-HcjhZwZSl4fK-mfQ, vL44Ky9VxUtOgteyHasRIA, 47Uu-2MceSRFmohdzCOvGQ, 8PmbCVEjWGPouD1Tst6FsQ, hJNjKc4sKgWG__KitlJ1ag, S1eha-aT5c7WMk7lDLsW0A, aIs7Tt3pw6ymj3FOPPR4Ng, Kcg5iMwYq5ibBuEhDXKx3Q"
21,SlSpryqL91enzQTEnIQ4yQ,"8axxI33rUyswfRk_v3vS0A, Q0fcX_1wvdmffqEPa246rg, WUAe0FGaLRCremEDXqNV4A, ZOyBVpeSQ7sYDeZa_v0MFw, 1X9DnaRUexCmwohV2E-f1g, hJNjKc4sKgWG__KitlJ1ag, PiT0jyLL2Jwm2ODTDapOcg, E7s0QreUJ2H9r0Ls1yDeiQ, vL44Ky9VxUtOgteyHasRIA, yYh6t6a_0LGLVS_MNYEHsQ"
22,5Mujjzv-ZH6HhxT-hWCpVg,"Sqwa2aNwnqCmc95gVWQ9bA, S1eha-aT5c7WMk7lDLsW0A, hz0ldhBHu5M4ri9M_mkOdQ, se9MhDAQjACYMO3LCIfT1Q, xjBvbDmbsA0VX-vA55SbAA, 563C7-HcjhZwZSl4fK-mfQ, V0tRCjf95FTqVJvmxdeqbQ, 8axxI33rUyswfRk_v3vS0A, 5Iin0tl6QJT_TyL1BldtyA, 47Uu-2MceSRFmohdzCOvGQ"
23,3XDGNCH155seEXyEQPMi_w,"vL44Ky9VxUtOgteyHasRIA, W-kOZ946xRWBJZvxXhJ7DA, N8hUGYmf0jEO9eDzmYHuAw, XahLCgicRsLPb0TSMAIQtw, 563C7-HcjhZwZSl4fK-mfQ, 6MR9GZjWjLAS3s39YdDXKw, Kcg5iMwYq5ibBuEhDXKx3Q, cgEzHZQKhi2anXfyF75MQw, J_KI8rJa_dSwTglUbwFcdw, kYDkMGQEuQIeSOGZHHjIxA"
24,rVEQ7nG4Bo7utMcqURxaIQ,"sH-11zOhWubXobEeuMo2gg, vL44Ky9VxUtOgteyHasRIA, vy5dhJyQ_VC1NUpPMmRUlw, _TqUO2XaxLQ9i_z3RM8puQ, XahLCgicRsLPb0TSMAIQtw, hf_TA4bRRnzLQh2XUbqX6w, QMySP-qHdwQNZY0gDba0ng, Q0fcX_1wvdmffqEPa246rg, z-3ZDmVbHZjDrYZE42yKZA, S1eha-aT5c7WMk7lDLsW0A"
25,chG_7z0aA-TMs53pzYZFdg,"E7s0QreUJ2H9r0Ls1yDeiQ, QMySP-qHdwQNZY0gDba0ng, Q0fcX_1wvdmffqEPa246rg, 563C7-HcjhZwZSl4fK-mfQ, FMoKoSHgitwnt_iMWm31nQ, se9MhDAQjACYMO3LCIfT1Q, Rx85NUdD6MhrgKxHr05NlQ, nJdNzQ5Z278gTCFJ4HQBLA, IWNPEvd3o6GHi60MxnPCVQ, hJNjKc4sKgWG__KitlJ1ag"
26,aAVaN6Zw6-cRm5nftmOVJQ,"gtx0OZnN98YXAASyMzv3hw, 2vOHS-_p5ylEf0BGR1dO9w, S1eha-aT5c7WMk7lDLsW0A, 563C7-HcjhZwZSl4fK-mfQ, hJNjKc4sKgWG__KitlJ1ag, vL44Ky9VxUtOgteyHasRIA, z-3ZDmVbHZjDrYZE42yKZA, se9MhDAQjACYMO3LCIfT1Q, FMoKoSHgitwnt_iMWm31nQ, LUhVj-r2TtmFx6cyF9ilJg"
27,rDacT7_YW2-geunGcmgeEw,"S1eha-aT5c7WMk7lDLsW0A, FMoKoSHgitwnt_iMWm31nQ, xbCNlp2vWixy2W1WsfGv8g, aIs7Tt3pw6ymj3FOPPR4Ng, voaZjLwStQEq9-wj7hFYBQ, E7s0QreUJ2H9r0Ls1yDeiQ, 563C7-HcjhZwZSl4fK-mfQ, 3UqJKEDIh7o0aTtVUo187Q, 9RKjjuTQYkYpGmCtfVsTZQ, K8D_ltZWGvdXUaSE7bBiDw"
28,TrSM8ON_YdVASOJmMbwnGA,"563C7-HcjhZwZSl4fK-mfQ, gqsU03i-WiyYHcBCdwObuQ, nJdNzQ5Z278gTCFJ4HQBLA, se9MhDAQjACYMO3LCIfT1Q, o9KcGDv2Lkbtit7mxZs8qA, 36jGZp7V0jLnPCYmRipUCg, adI5BlJCtvWq2uAwmyndXA, LUhVj-r2TtmFx6cyF9ilJg, 8PmbCVEjWGPouD1Tst6FsQ, ZOyBVpeSQ7sYDeZa_v0MFw"
29,asf3NiIfdlbiCUUwCO4iWg,"6MR9GZjWjLAS3s39YdDXKw, KMlY-L1oAL3qMQnwQCJPhQ, csbBCysrsifg8N10c0eHCA, xbCNlp2vWixy2W1WsfGv8g, _TqUO2XaxLQ9i_z3RM8puQ, cgEzHZQKhi2anXfyF75MQw, qesu3mk5yHeak9CUO4gRdQ, 3hjLxqqEfnBhwL6ecave_g, mVZoin0a8uTZgLsgJ9iNDQ, Q0fcX_1wvdmffqEPa246rg"
30,mJJj_SZff6MEWG5Vx1r8Bg,"563C7-HcjhZwZSl4fK-mfQ, 8PmbCVEjWGPouD1Tst6FsQ, vL44Ky9VxUtOgteyHasRIA, 3hjLxqqEfnBhwL6ecave_g, Kcg5iMwYq5ibBuEhDXKx3Q, se9MhDAQjACYMO3LCIfT1Q, xjBvbDmbsA0VX-vA55SbAA, qs9nL2T2guSLEudFHg71mw, hz0ldhBHu5M4ri9M_mkOdQ, 47Uu-2MceSRFmohdzCOvGQ"
31,DR6kA7EWIiGIEMuXASJL2w,"6MR9GZjWjLAS3s39YdDXKw, z57omnqRcAODGwbwMHEIyw, zc_ptb03jQiXnWGwmpAk0A, 6lcRVoeg4hiy52_sj3H4HA, Rx85NUdD6MhrgKxHr05NlQ, EKEPtNKJdZxRhYoFhuG8ew, 366NwqHwhOic5pBN1DjmDQ, 563C7-HcjhZwZSl4fK-mfQ, 0SBDr7GJAFzKECE7IIWfJA, Nvi9RLcOdrJvSwcw-ziZQQ"
32,xan14G_7IU66GtQPAA2cKw,"lWRbdK9YABr0auLG19FHhQ, xWuzWH8qYaa75REqVd9Isw, 563C7-HcjhZwZSl4fK-mfQ, se9MhDAQjACYMO3LCIfT1Q, K8D_ltZWGvdXUaSE7bBiDw, hJNjKc4sKgWG__KitlJ1ag, S1eha-aT5c7WMk7lDLsW0A, P_q9rwxm-O-8cQ3xiswHHg, 3hjLxqqEfnBhwL6ecave_g, AUiX65HxQqwk1yvsBcbTdQ"
33,e-jVwvMAiHTUYIRSmJKFAA,"366NwqHwhOic5pBN1DjmDQ, z57omnqRcAODGwbwMHEIyw, BmrVL3Aj5usPfpu5DE1iCg, 0SBDr7GJAFzKECE7IIWfJA, S1eha-aT5c7WMk7lDLsW0A, 563C7-HcjhZwZSl4fK-mfQ, cgEzHZQKhi2anXfyF75MQw, g38pY1WD5dbmEuv0Bkx8QQ, xlHRYejgZj-iTm-QPhc8zQ, E7s0QreUJ2H9r0Ls1yDeiQ"
34,QFQGMnOEoqii9ttB9t-RXg,"563C7-HcjhZwZSl4fK-mfQ, xbCNlp2vWixy2W1WsfGv8g, E7s0QreUJ2H9r0Ls1yDeiQ, se9MhDAQjACYMO3LCIfT1Q, 9RKjjuTQYkYpGmCtfVsTZQ, BmrVL3Aj5usPfpu5DE1iCg, 8PmbCVEjWGPouD1Tst6FsQ, Q0fcX_1wvdmffqEPa246rg, sH-11zOhWubXobEeuMo2gg, gtx0OZnN98YXAASyMzv3hw"
35,brpOnxaRsg56LK7OverL0A,"E7s0QreUJ2H9r0Ls1yDeiQ, GS06uO84yKQpa7oezgVZgQ, aIs7Tt3pw6ymj3FOPPR4Ng, N8hUGYmf0jEO9eDzmYHuAw, FMoKoSHgitwnt_iMWm31nQ, vL44Ky9VxUtOgteyHasRIA, adI5BlJCtvWq2uAwmyndXA, hf_TA4bRRnzLQh2XUbqX6w, 3hjLxqqEfnBhwL6ecave_g, gJliACNKY4rK30BTMIzwsQ"
36,xJKnmUxpJfzPovCTsT1kLg,"5Iin0tl6QJT_TyL1BldtyA, Q0fcX_1wvdmffqEPa246rg, se9MhDAQjACYMO3LCIfT1Q, lWRbdK9YABr0auLG19FHhQ, B9gUwTS1_Yzj2vajjC7Vmg, csbBCysrsifg8N10c0eHCA, PiT0jyLL2Jwm2ODTDapOcg, ZWwtcMzhADrhoAxSsoc3HQ, AUiX65HxQqwk1yvsBcbTdQ, aJvi4k0ndFlGBzSZzcbnTw"
37,dLOfp-2TAGAb78jGZPvMoA,"qeFGUu1WPvMMNn5Hno6D-Q, V8vKFvdrvhTrQrt-rxKrPA, AUiX65HxQqwk1yvsBcbTdQ, 3hjLxqqEfnBhwL6ecave_g, 2vOHS-_p5ylEf0BGR1dO9w, Q0fcX_1wvdmffqEPa246rg, 6MR9GZjWjLAS3s39YdDXKw, zc_ptb03jQiXnWGwmpAk0A, fbZKVUec4oNGmPRXzWGpxQ, xWuzWH8qYaa75REqVd9Isw"
38,Q-G5vPCbC9708m9Mw3fZVA,"AUiX65HxQqwk1yvsBcbTdQ, Q0fcX_1wvdmffqEPa246rg, s7TMkWF36dwwD8R3TKsJqw, se9MhDAQjACYMO3LCIfT1Q, EiYE3T3hfqcpcficZ4zJzQ, 4owK2zpqI7qQ774DSNTkjQ, 2vOHS-_p5ylEf0BGR1dO9w, aHYIubjRbTLB3o_eXkrMXA, 366NwqHwhOic5pBN1DjmDQ, _TqUO2XaxLQ9i_z3RM8puQ"
39,PuzhvFmuIvrCgJ_GRqyJPg,"xbCNlp2vWixy2W1WsfGv8g, FMoKoSHgitwnt_iMWm31nQ, EiYE3T3hfqcpcficZ4zJzQ, pM4mWLjeaZJlcdUxut2lMg, XahLCgicRsLPb0TSMAIQtw, BXeXS9EaNN03AptFwElvjA, KtUuxN2gZXeC7WpJ_w9hNg, g_fGPZJlGeKGLgC-j-tj6w, aHYIubjRbTLB3o_eXkrMXA, HTBFKmtOzqlGvdpJpBfRng"
40,uaP7yULocq3L_XXClUu67Q,"z57omnqRcAODGwbwMHEIyw, cgEzHZQKhi2anXfyF75MQw, gtx0OZnN98YXAASyMzv3hw, B9gUwTS1_Yzj2vajjC7Vmg, E7s0QreUJ2H9r0Ls1yDeiQ, FMoKoSHgitwnt_iMWm31nQ, 5Iin0tl6QJT_TyL1BldtyA, se9MhDAQjACYMO3LCIfT1Q, qDPn14lenAGehkbnJaqnYg, _jNe_vwxiEh0G9JRZByc0w"
41,FmbduNxDfGN7TiHrY2UewA,"E7s0QreUJ2H9r0Ls1yDeiQ, ksP8426d2qN-mg-JDpkRVQ, hf_TA4bRRnzLQh2XUbqX6w, APN05ziH92oIox8EMxcceg, pM4mWLjeaZJlcdUxut2lMg, W-kOZ946xRWBJZvxXhJ7DA, vy5dhJyQ_VC1NUpPMmRUlw, GS06uO84yKQpa7oezgVZgQ, nbJXmGpdCxiBnovBkBtWcA, FMoKoSHgitwnt_iMWm31nQ"
42,0-wo7wKN_Rp0Xs6cBMEDJQ,"IWNPEvd3o6GHi60MxnPCVQ, FMoKoSHgitwnt_iMWm31nQ, 6MR9GZjWjLAS3s39YdDXKw, E7s0QreUJ2H9r0Ls1yDeiQ, 3UqJKEDIh7o0aTtVUo187Q, 2HMvoTz_hw0noLzBWmyxcA, yYh6t6a_0LGLVS_MNYEHsQ, 8Haoz9Mil7ZnHGU48sgBtw, E_scgX9Vws9adbh4i_QJnQ, sH-11zOhWubXobEeuMo2gg"
43,fL35Nuk-Nde5BJfOD0W_EQ,"z57omnqRcAODGwbwMHEIyw, 8axxI33rUyswfRk_v3vS0A, xbCNlp2vWixy2W1WsfGv8g, 2vOHS-_p5ylEf0BGR1dO9w, rvOvog5Utw3VXBwiSCAl0A, 366NwqHwhOic5pBN1DjmDQ, QMySP-qHdwQNZY0gDba0ng, FMoKoSHgitwnt_iMWm31nQ, Nvi9RLcOdrJvSwcw-ziZQQ, cwM9xFaKGWeeS4uRJPfMbA"
44,E7UTVunQLtiTnGYBlUQFDg,"xbCNlp2vWixy2W1WsfGv8g, Djazk_urUgj9C6PTwg-2AA, l_tk3iLmyKfBUCK-6nBbHg, tD1veHsKELAH3b7wKmHsaw, 6MR9GZjWjLAS3s39YdDXKw, APN05ziH92oIox8EMxcceg, 2HMvoTz_hw0noLzBWmyxcA, nbJXmGpdCxiBnovBkBtWcA, o9KcGDv2Lkbtit7mxZs8qA, S1eha-aT5c7WMk7lDLsW0A"
45,DdaPc_xbu6or0qcTPVd1bQ,"LUhVj-r2TtmFx6cyF9ilJg, 2HMvoTz_hw0noLzBWmyxcA, ZOyBVpeSQ7sYDeZa_v0MFw, Q0fcX_1wvdmffqEPa246rg, vL44Ky9VxUtOgteyHasRIA, YHlpp0gYBcxL_YXZepT69g, 22nkIQ4BeSYwsyaPOczOeA, aJvi4k0ndFlGBzSZzcbnTw, nJdNzQ5Z278gTCFJ4HQBLA, P_q9rwxm-O-8cQ3xiswHHg"
46,RmXIjppHNtVveguN10iO1g,"se9MhDAQjACYMO3LCIfT1Q, KMlY-L1oAL3qMQnwQCJPhQ, yYh6t6a_0LGLVS_MNYEHsQ, K8D_ltZWGvdXUaSE7bBiDw, nJdNzQ5Z278gTCFJ4HQBLA, 9RKjjuTQYkYpGmCtfVsTZQ, FMoKoSHgitwnt_iMWm31nQ, 563C7-HcjhZwZSl4fK-mfQ, l_tk3iLmyKfBUCK-6nBbHg, HTBFKmtOzqlGvdpJpBfRng"
47,-0WUJsVpizkaAYQp05giUA,"563C7-HcjhZwZSl4fK-mfQ, 8PmbCVEjWGPouD1Tst6FsQ, PcR-9sTQRK_UN7qO9rzDNw, z57omnqRcAODGwbwMHEIyw, fNtFIQM_FKsHsyEIVk_KMQ, kHWSO8fV0Mp-M3J-w1ma7A, xjBvbDmbsA0VX-vA55SbAA, I1j1kEbQ5BliKsjzl5etVA, zc_ptb03jQiXnWGwmpAk0A, EiYE3T3hfqcpcficZ4zJzQ"
48,tXIN2tMOAiZH-lGwEaHOkg,"3hjLxqqEfnBhwL6ecave_g, sH-11zOhWubXobEeuMo2gg, KMlY-L1oAL3qMQnwQCJPhQ, _TqUO2XaxLQ9i_z3RM8puQ, xbCNlp2vWixy2W1WsfGv8g, nbF7bEjx_4lQJ3t6aVqFjA, E7s0QreUJ2H9r0Ls1yDeiQ, 8PmbCVEjWGPouD1Tst6FsQ, 36jGZp7V0jLnPCYmRipUCg, K8D_ltZWGvdXUaSE7bBiDw"
49,6FFFFNZLeeHERUs1MatgBg,"S1eha-aT5c7WMk7lDLsW0A, xjBvbDmbsA0VX-vA55SbAA, 2vOHS-_p5ylEf0BGR1dO9w, xbCNlp2vWixy2W1WsfGv8g, W-kOZ946xRWBJZvxXhJ7DA, AUiX65HxQqwk1yvsBcbTdQ, s7TMkWF36dwwD8R3TKsJqw, lWRbdK9YABr0auLG19FHhQ, Qe7yHDU5SPTsLVqQ6Cgnsw, se9MhDAQjACYMO3LCIfT1Q"
50,mptGtDdTKaoKPxYY2puS5Q,"0SBDr7GJAFzKECE7IIWfJA, s7TMkWF36dwwD8R3TKsJqw, sH-11zOhWubXobEeuMo2gg, ZOyBVpeSQ7sYDeZa_v0MFw, 6MR9GZjWjLAS3s39YdDXKw, xbCNlp2vWixy2W1WsfGv8g, PiT0jyLL2Jwm2ODTDapOcg, te-QMdSMQdjws6NnRexjJQ, wXob57ntnAnzSEWnt9syEQ, W-kOZ946xRWBJZvxXhJ7DA"
51,l_n89Nfn1BSJENwHy9nt-A,"z-3ZDmVbHZjDrYZE42yKZA, se9MhDAQjACYMO3LCIfT1Q, P_q9rwxm-O-8cQ3xiswHHg, 366NwqHwhOic5pBN1DjmDQ, u9iy3hyA9HpETKi9qns__A, Rx85NUdD6MhrgKxHr05NlQ, hJNjKc4sKgWG__KitlJ1ag, W-kOZ946xRWBJZvxXhJ7DA, XahLCgicRsLPb0TSMAIQtw, xjBvbDmbsA0VX-vA55SbAA"
52,ixBoXpBL1JmKmcP1F2fTHA,"S1eha-aT5c7WMk7lDLsW0A, 8PmbCVEjWGPouD1Tst6FsQ, 8axxI33rUyswfRk_v3vS0A, 6MR9GZjWjLAS3s39YdDXKw, xWuzWH8qYaa75REqVd9Isw, P_q9rwxm-O-8cQ3xiswHHg, 563C7-HcjhZwZSl4fK-mfQ, xjBvbDmbsA0VX-vA55SbAA, PiT0jyLL2Jwm2ODTDapOcg, lWRbdK9YABr0auLG19FHhQ"
53,lh1QIr8Bp8WOI1ws1tPZWA,"z57omnqRcAODGwbwMHEIyw, zc_ptb03jQiXnWGwmpAk0A, hz0ldhBHu5M4ri9M_mkOdQ, Q0fcX_1wvdmffqEPa246rg, voaZjLwStQEq9-wj7hFYBQ, N8hUGYmf0jEO9eDzmYHuAw, tuucCa40AmTMUEVNerGe9w, gtx0OZnN98YXAASyMzv3hw, lWRbdK9YABr0auLG19FHhQ, 6MR9GZjWjLAS3s39YdDXKw"
54,3HsiYKmrVW2nMDwHMpsrzQ,"s7TMkWF36dwwD8R3TKsJqw, 563C7-HcjhZwZSl4fK-mfQ, 366NwqHwhOic5pBN1DjmDQ, FMoKoSHgitwnt_iMWm31nQ, 36jGZp7V0jLnPCYmRipUCg, L4ivYHVCDpIE0SrPaCn0LA, 5Iin0tl6QJT_TyL1BldtyA, aIs7Tt3pw6ymj3FOPPR4Ng, 2vOHS-_p5ylEf0BGR1dO9w, KMlY-L1oAL3qMQnwQCJPhQ"
55,OdUSlS-S6qfZFnDUCKzwEg,"36jGZp7V0jLnPCYmRipUCg, xWuzWH8qYaa75REqVd9Isw, u9iy3hyA9HpETKi9qns__A, Kcg5iMwYq5ibBuEhDXKx3Q, lWRbdK9YABr0auLG19FHhQ, xjBvbDmbsA0VX-vA55SbAA, Q0fcX_1wvdmffqEPa246rg, se9MhDAQjACYMO3LCIfT1Q, qs9nL2T2guSLEudFHg71mw, hz0ldhBHu5M4ri9M_mkOdQ"
56,KcfGrudzTcML2md1gwP53g,"563C7-HcjhZwZSl4fK-mfQ, 3hjLxqqEfnBhwL6ecave_g, Sqwa2aNwnqCmc95gVWQ9bA, hz0ldhBHu5M4ri9M_mkOdQ, V0tRCjf95FTqVJvmxdeqbQ, l_tk3iLmyKfBUCK-6nBbHg, pM4mWLjeaZJlcdUxut2lMg, tD1veHsKELAH3b7wKmHsaw, sjrTFzrb7_pzzBEpC-BvpA, xjBvbDmbsA0VX-vA55SbAA"
57,w6T9G6r1QtPRoOYrFVEM1w,"563C7-HcjhZwZSl4fK-mfQ, nJdNzQ5Z278gTCFJ4HQBLA, Q0fcX_1wvdmffqEPa246rg, z57omnqRcAODGwbwMHEIyw, L4ivYHVCDpIE0SrPaCn0LA, EKEPtNKJdZxRhYoFhuG8ew, AUiX65HxQqwk1yvsBcbTdQ, azHkCTTMfAWDM0KNp5wqzw, JOqWln_EB_f6RUSTxl04dQ, J_KI8rJa_dSwTglUbwFcdw"
58,-ZM78Lp6guNOiE6yJNAJHw,"adI5BlJCtvWq2uAwmyndXA, P_q9rwxm-O-8cQ3xiswHHg, 8PmbCVEjWGPouD1Tst6FsQ, u9iy3hyA9HpETKi9qns__A, vL44Ky9VxUtOgteyHasRIA, hJNjKc4sKgWG__KitlJ1ag, ZOyBVpeSQ7sYDeZa_v0MFw, z-3ZDmVbHZjDrYZE42yKZA, XarxHcmxyjvhzoROMTLyMg, LUhVj-r2TtmFx6cyF9ilJg"
59,L3kgTysYuNKMtGPBZiP_bA,"se9MhDAQjACYMO3LCIfT1Q, 563C7-HcjhZwZSl4fK-mfQ, S1eha-aT5c7WMk7lDLsW0A, z57omnqRcAODGwbwMHEIyw, Kcg5iMwYq5ibBuEhDXKx3Q, 3UqJKEDIh7o0aTtVUo187Q, P_q9rwxm-O-8cQ3xiswHHg, u9iy3hyA9HpETKi9qns__A, xjBvbDmbsA0VX-vA55SbAA, 47Uu-2MceSRFmohdzCOvGQ"
60,6S6sZMLuy_StHVs2lqpUUw,"sH-11zOhWubXobEeuMo2gg, B9gUwTS1_Yzj2vajjC7Vmg, PcR-9sTQRK_UN7qO9rzDNw, QMySP-qHdwQNZY0gDba0ng, iyBlON0Ipc0kbF-YOYxmOQ, NW3KM7K7ywzEfqk3OR4tAQ, te-QMdSMQdjws6NnRexjJQ, _TqUO2XaxLQ9i_z3RM8puQ, csbBCysrsifg8N10c0eHCA, l_tk3iLmyKfBUCK-6nBbHg"
61,WW3uGfrqB4tTDlQMKCiDbA,"Kcg5iMwYq5ibBuEhDXKx3Q, 8axxI33rUyswfRk_v3vS0A, Z-9ZLg77FXTQCMqp1gGsrQ, AEVNOYRr8ZsG1bj3NuEKgA, hz0ldhBHu5M4ri9M_mkOdQ, AUiX65HxQqwk1yvsBcbTdQ, E8PkjCmDnDE7_2rYf38lRA, 6MR9GZjWjLAS3s39YdDXKw, XarxHcmxyjvhzoROMTLyMg, BTDPN3hMRrENFZNb76lPKw"
62,mJM9uvrQ0q1nrSn1xRbHQQ,"563C7-HcjhZwZSl4fK-mfQ, _jNe_vwxiEh0G9JRZByc0w, IYdv6RxSiqz2XMsqkiTmPQ, GS06uO84yKQpa7oezgVZgQ, vL44Ky9VxUtOgteyHasRIA, S1eha-aT5c7WMk7lDLsW0A, WUAe0FGaLRCremEDXqNV4A, fbZKVUec4oNGmPRXzWGpxQ, hz0ldhBHu5M4ri9M_mkOdQ, xWuzWH8qYaa75REqVd9Isw"
63,cDR_WMmV9dp2LwW-w_KmUA,"vL44Ky9VxUtOgteyHasRIA, 563C7-HcjhZwZSl4fK-mfQ, Kcg5iMwYq5ibBuEhDXKx3Q, 3UqJKEDIh7o0aTtVUo187Q, S1eha-aT5c7WMk7lDLsW0A, cgEzHZQKhi2anXfyF75MQw, XahLCgicRsLPb0TSMAIQtw, FMoKoSHgitwnt_iMWm31nQ, se9MhDAQjACYMO3LCIfT1Q, 8PmbCVEjWGPouD1Tst6FsQ"
64,qFOy-T6HU4WxS5t_34IBaQ,"xbCNlp2vWixy2W1WsfGv8g, cgEzHZQKhi2anXfyF75MQw, J_KI8rJa_dSwTglUbwFcdw, rvOvog5Utw3VXBwiSCAl0A, _TqUO2XaxLQ9i_z3RM8puQ, aIs7Tt3pw6ymj3FOPPR4Ng, QMySP-qHdwQNZY0gDba0ng, 2HMvoTz_hw0noLzBWmyxcA, Q0fcX_1wvdmffqEPa246rg, S1eha-aT5c7WMk7lDLsW0A"
65,JUc49GPNufVHhPl2BIoAAw,"xjBvbDmbsA0VX-vA55SbAA, _jNe_vwxiEh0G9JRZByc0w, EiYE3T3hfqcpcficZ4zJzQ, pM4mWLjeaZJlcdUxut2lMg, V8vKFvdrvhTrQrt-rxKrPA, hz0ldhBHu5M4ri9M_mkOdQ, yv8m3r2v3xQtDCYnwJa99Q, oAsjdHwXgKtK-NU_JEYuPg, QMySP-qHdwQNZY0gDba0ng, z57omnqRcAODGwbwMHEIyw"
66,2C7OiKoA9Tqkt76siBbRYA,"563C7-HcjhZwZSl4fK-mfQ, nbJXmGpdCxiBnovBkBtWcA, FMoKoSHgitwnt_iMWm31nQ, hJNjKc4sKgWG__KitlJ1ag, NW3KM7K7ywzEfqk3OR4tAQ, sH-11zOhWubXobEeuMo2gg, N1BTJaWnLsCVsJ3I41EPdg, Q0fcX_1wvdmffqEPa246rg, 2vOHS-_p5ylEf0BGR1dO9w, zc_ptb03jQiXnWGwmpAk0A"
67,r45-ZWkRzYk8_FnN4Wgnfw,"I1j1kEbQ5BliKsjzl5etVA, xjBvbDmbsA0VX-vA55SbAA, J_KI8rJa_dSwTglUbwFcdw, BmrVL3Aj5usPfpu5DE1iCg, z57omnqRcAODGwbwMHEIyw, E7s0QreUJ2H9r0Ls1yDeiQ, Kcg5iMwYq5ibBuEhDXKx3Q, se9MhDAQjACYMO3LCIfT1Q, S1eha-aT5c7WMk7lDLsW0A, adI5BlJCtvWq2uAwmyndXA"
68,-zhW9UyMKOMuuydi17x7Ag,"sH-11zOhWubXobEeuMo2gg, W-kOZ946xRWBJZvxXhJ7DA, cgEzHZQKhi2anXfyF75MQw, z57omnqRcAODGwbwMHEIyw, FMoKoSHgitwnt_iMWm31nQ, MuVIpRAEkNfRnmhsPTdl3A, oAsjdHwXgKtK-NU_JEYuPg, ZOyBVpeSQ7sYDeZa_v0MFw, IWNPEvd3o6GHi60MxnPCVQ, yYh6t6a_0LGLVS_MNYEHsQ"
69,tI5jVZ1CGZr2tLt1cwGZ5g,"Kcg5iMwYq5ibBuEhDXKx3Q, Q0fcX_1wvdmffqEPa246rg, AUiX65HxQqwk1yvsBcbTdQ, tD1veHsKELAH3b7wKmHsaw, xWuzWH8qYaa75REqVd9Isw, 0SBDr7GJAFzKECE7IIWfJA, BmrVL3Aj5usPfpu5DE1iCg, xOZ7bkrttSIGS4NZm49w5Q, 563C7-HcjhZwZSl4fK-mfQ, yYh6t6a_0LGLVS_MNYEHsQ"
70,1otkilxTrHF6Z1vdrrlZrQ,"5Iin0tl6QJT_TyL1BldtyA, E7s0QreUJ2H9r0Ls1yDeiQ, se9MhDAQjACYMO3LCIfT1Q, B9gUwTS1_Yzj2vajjC7Vmg, Q0fcX_1wvdmffqEPa246rg, nJdNzQ5Z278gTCFJ4HQBLA, GS06uO84yKQpa7oezgVZgQ, cgEzHZQKhi2anXfyF75MQw, IWNPEvd3o6GHi60MxnPCVQ, nbJXmGpdCxiBnovBkBtWcA"
71,sJ-LZrznwzO49Syt_cI7Sg,"xWuzWH8qYaa75REqVd9Isw, hJNjKc4sKgWG__KitlJ1ag, te-QMdSMQdjws6NnRexjJQ, cgEzHZQKhi2anXfyF75MQw, Q0fcX_1wvdmffqEPa246rg, FMoKoSHgitwnt_iMWm31nQ, xbCNlp2vWixy2W1WsfGv8g, aHYIubjRbTLB3o_eXkrMXA, BmrVL3Aj5usPfpu5DE1iCg, vL44Ky9VxUtOgteyHasRIA"
72,QyP254XCNlI7DvPsze5LQw,"S1eha-aT5c7WMk7lDLsW0A, Kcg5iMwYq5ibBuEhDXKx3Q, EKEPtNKJdZxRhYoFhuG8ew, qmcIsZjLpxd0V4RekSozmA, xjBvbDmbsA0VX-vA55SbAA, eRNDudpCqrDuRaz4-reNOQ, GS06uO84yKQpa7oezgVZgQ, SD3ZyFR5ZjFneWpYhT6tLg, l_tk3iLmyKfBUCK-6nBbHg, V0tRCjf95FTqVJvmxdeqbQ"
73,hpCpVb1Ty9LoYQ0-gzRDDw,"2vOHS-_p5ylEf0BGR1dO9w, FMoKoSHgitwnt_iMWm31nQ, LUhVj-r2TtmFx6cyF9ilJg, pM4mWLjeaZJlcdUxut2lMg, E7s0QreUJ2H9r0Ls1yDeiQ, 563C7-HcjhZwZSl4fK-mfQ, cgEzHZQKhi2anXfyF75MQw, L4ivYHVCDpIE0SrPaCn0LA, xOZ7bkrttSIGS4NZm49w5Q, hz0ldhBHu5M4ri9M_mkOdQ"
74,-TJhZseJMYZjOab0wMOnAQ,"J_KI8rJa_dSwTglUbwFcdw, AUiX65HxQqwk1yvsBcbTdQ, se9MhDAQjACYMO3LCIfT1Q, 563C7-HcjhZwZSl4fK-mfQ, _TqUO2XaxLQ9i_z3RM8puQ, xWuzWH8qYaa75REqVd9Isw, xOZ7bkrttSIGS4NZm49w5Q, z57omnqRcAODGwbwMHEIyw, cgEzHZQKhi2anXfyF75MQw, utYpyFOjNisHl1h7lDGSGA"
75,hIZiWElzEfM4Jh_xkrDVpg,"nJdNzQ5Z278gTCFJ4HQBLA, z57omnqRcAODGwbwMHEIyw, Vtahv3Af90H3fUuEEhPhdQ, cgEzHZQKhi2anXfyF75MQw, u9iy3hyA9HpETKi9qns__A, 366NwqHwhOic5pBN1DjmDQ, pM4mWLjeaZJlcdUxut2lMg, 8axxI33rUyswfRk_v3vS0A, J_KI8rJa_dSwTglUbwFcdw, XahLCgicRsLPb0TSMAIQtw"
76,ZYZNcugF3xUEGyLOVGiZ0Q,"wNy3CnWWAnTCfDYsZTSUPw, MuVIpRAEkNfRnmhsPTdl3A, nJdNzQ5Z278gTCFJ4HQBLA, FMoKoSHgitwnt_iMWm31nQ, xWuzWH8qYaa75REqVd9Isw, Q0fcX_1wvdmffqEPa246rg, 563C7-HcjhZwZSl4fK-mfQ, xOZ7bkrttSIGS4NZm49w5Q, 85Y24Itl548cCCVV2d8HxQ, YST4gp2ecFtyUpRAFNZ_HQ"
77,Oj8RHeu2_I9hMmme8IbU4A,"W-kOZ946xRWBJZvxXhJ7DA, 563C7-HcjhZwZSl4fK-mfQ, PiT0jyLL2Jwm2ODTDapOcg, qesu3mk5yHeak9CUO4gRdQ, XahLCgicRsLPb0TSMAIQtw, IWNPEvd3o6GHi60MxnPCVQ, FMoKoSHgitwnt_iMWm31nQ, LUhVj-r2TtmFx6cyF9ilJg, se9MhDAQjACYMO3LCIfT1Q, E7s0QreUJ2H9r0Ls1yDeiQ"
78,nBwONfmYwAK-wpw-1SKxYA,"Rx85NUdD6MhrgKxHr05NlQ, e8ohWYW8rbOZWZ4pojU4zQ, 563C7-HcjhZwZSl4fK-mfQ, sH-11zOhWubXobEeuMo2gg, 22nkIQ4BeSYwsyaPOczOeA, QMySP-qHdwQNZY0gDba0ng, se9MhDAQjACYMO3LCIfT1Q, z57omnqRcAODGwbwMHEIyw, xWuzWH8qYaa75REqVd9Isw, MGOBNMCuhnYRcaiBj9-g1Q"
79,DWxUS4lNikQQgD3GaiHf8Q,"r_KDxVcTZVEigYepnoJ6Lw, xbCNlp2vWixy2W1WsfGv8g, EiYE3T3hfqcpcficZ4zJzQ, N8hUGYmf0jEO9eDzmYHuAw, z57omnqRcAODGwbwMHEIyw, Rx85NUdD6MhrgKxHr05NlQ, 563C7-HcjhZwZSl4fK-mfQ, voaZjLwStQEq9-wj7hFYBQ, gtx0OZnN98YXAASyMzv3hw, RiPhiTDvmhqlF9BYWv8mtA"
80,dq27itUgsOV9ObbtpBRezQ,"voaZjLwStQEq9-wj7hFYBQ, I1j1kEbQ5BliKsjzl5etVA, E7s0QreUJ2H9r0Ls1yDeiQ, 0HyuO5rOKeaa08TFzjIJIA, Z-9ZLg77FXTQCMqp1gGsrQ, GS06uO84yKQpa7oezgVZgQ, nJdNzQ5Z278gTCFJ4HQBLA, IYdv6RxSiqz2XMsqkiTmPQ, R79Hir871EF-kRLIBPy9qg, 8PmbCVEjWGPouD1Tst6FsQ"
81,lOZKlSyQa-jSv4HZ66okGg,"E7s0QreUJ2H9r0Ls1yDeiQ, K8D_ltZWGvdXUaSE7bBiDw, hJNjKc4sKgWG__KitlJ1ag, W-kOZ946xRWBJZvxXhJ7DA, u9iy3hyA9HpETKi9qns__A, P_q9rwxm-O-8cQ3xiswHHg, z57omnqRcAODGwbwMHEIyw, 563C7-HcjhZwZSl4fK-mfQ, LUhVj-r2TtmFx6cyF9ilJg, VecnSuJm8sD83LWJ_KqAtg"
82,F0nFAY1Qi_7it_Q52n3nTw,"hJNjKc4sKgWG__KitlJ1ag, 8Haoz9Mil7ZnHGU48sgBtw, 8axxI33rUyswfRk_v3vS0A, S1eha-aT5c7WMk7lDLsW0A, 36jGZp7V0jLnPCYmRipUCg, xjBvbDmbsA0VX-vA55SbAA, x1bjSvpIJTN1KBFhUjOU_g, z57omnqRcAODGwbwMHEIyw, J_KI8rJa_dSwTglUbwFcdw, xWuzWH8qYaa75REqVd9Isw"
83,ZD3_a2-bcugIQfh_0rWqIQ,"8PmbCVEjWGPouD1Tst6FsQ, LUhVj-r2TtmFx6cyF9ilJg, u9iy3hyA9HpETKi9qns__A, xbCNlp2vWixy2W1WsfGv8g, E7s0QreUJ2H9r0Ls1yDeiQ, 563C7-HcjhZwZSl4fK-mfQ, te-QMdSMQdjws6NnRexjJQ, P_q9rwxm-O-8cQ3xiswHHg, xOZ7bkrttSIGS4NZm49w5Q, XarxHcmxyjvhzoROMTLyMg"
84,4FxADcoBgm_8xqTyfmTIug,"cgEzHZQKhi2anXfyF75MQw, ZOyBVpeSQ7sYDeZa_v0MFw, hJNjKc4sKgWG__KitlJ1ag, u9iy3hyA9HpETKi9qns__A, vL44Ky9VxUtOgteyHasRIA, xbCNlp2vWixy2W1WsfGv8g, nbF7bEjx_4lQJ3t6aVqFjA, bMEZKjo5LTZS3Hk7zGKflQ, _TqUO2XaxLQ9i_z3RM8puQ, adI5BlJCtvWq2uAwmyndXA"
85,l0-VQ8nA_oijpKlRB7dkow,"K8D_ltZWGvdXUaSE7bBiDw, Q0fcX_1wvdmffqEPa246rg, se9MhDAQjACYMO3LCIfT1Q, 563C7-HcjhZwZSl4fK-mfQ, xWuzWH8qYaa75REqVd9Isw, 6MR9GZjWjLAS3s39YdDXKw, nJdNzQ5Z278gTCFJ4HQBLA, hJNjKc4sKgWG__KitlJ1ag, 6rGYvMWoH6KvbF-oQzOWIQ, l_tk3iLmyKfBUCK-6nBbHg"
86,8kWbwEqdgDjSogg56e6PnA,"S1eha-aT5c7WMk7lDLsW0A, B9gUwTS1_Yzj2vajjC7Vmg, qeFGUu1WPvMMNn5Hno6D-Q, GbRN507iOJ6JOU-dixk-PQ, xWuzWH8qYaa75REqVd9Isw, aIs7Tt3pw6ymj3FOPPR4Ng, WUAe0FGaLRCremEDXqNV4A, V8vKFvdrvhTrQrt-rxKrPA, V0tRCjf95FTqVJvmxdeqbQ, 563C7-HcjhZwZSl4fK-mfQ"
87,XKEaZzncxtx4BovE2eOAdw,"z57omnqRcAODGwbwMHEIyw, _jNe_vwxiEh0G9JRZByc0w, utYpyFOjNisHl1h7lDGSGA, gJliACNKY4rK30BTMIzwsQ, 563C7-HcjhZwZSl4fK-mfQ, qesu3mk5yHeak9CUO4gRdQ, zc_ptb03jQiXnWGwmpAk0A, 366NwqHwhOic5pBN1DjmDQ, EiYE3T3hfqcpcficZ4zJzQ, N8hUGYmf0jEO9eDzmYHuAw"
88,-0MQ4webH2uc1ZAsGsNENg,"AUiX65HxQqwk1yvsBcbTdQ, xbCNlp2vWixy2W1WsfGv8g, sH-11zOhWubXobEeuMo2gg, 563C7-HcjhZwZSl4fK-mfQ, 366NwqHwhOic5pBN1DjmDQ, Q0fcX_1wvdmffqEPa246rg, 6MR9GZjWjLAS3s39YdDXKw, _jNe_vwxiEh0G9JRZByc0w, pM4mWLjeaZJlcdUxut2lMg, 85Y24Itl548cCCVV2d8HxQ"
89,omLRfZKggXtjRWN_VXf7Fg,"8axxI33rUyswfRk_v3vS0A, 2vOHS-_p5ylEf0BGR1dO9w, Kcg5iMwYq5ibBuEhDXKx3Q, nJdNzQ5Z278gTCFJ4HQBLA, xWuzWH8qYaa75REqVd9Isw, EiYE3T3hfqcpcficZ4zJzQ, 563C7-HcjhZwZSl4fK-mfQ, AUiX65HxQqwk1yvsBcbTdQ, BmrVL3Aj5usPfpu5DE1iCg, b8-lt7cnQpcvHM6Qre-WZA"
90,rzB7X6rJckrK4kzSA3Dqng,"nJdNzQ5Z278gTCFJ4HQBLA, xWuzWH8qYaa75REqVd9Isw, QMySP-qHdwQNZY0gDba0ng, N1BTJaWnLsCVsJ3I41EPdg, Q0fcX_1wvdmffqEPa246rg, se9MhDAQjACYMO3LCIfT1Q, kHWSO8fV0Mp-M3J-w1ma7A, 36jGZp7V0jLnPCYmRipUCg, FMoKoSHgitwnt_iMWm31nQ, qeFGUu1WPvMMNn5Hno6D-Q"
91,aDct2Z6b3vHuX5ra35uALA,"z57omnqRcAODGwbwMHEIyw, cgEzHZQKhi2anXfyF75MQw, 366NwqHwhOic5pBN1DjmDQ, e8ohWYW8rbOZWZ4pojU4zQ, xOZ7bkrttSIGS4NZm49w5Q, 6MR9GZjWjLAS3s39YdDXKw, E8PkjCmDnDE7_2rYf38lRA, L4ivYHVCDpIE0SrPaCn0LA, ZOyBVpeSQ7sYDeZa_v0MFw, 2vOHS-_p5ylEf0BGR1dO9w"
92,t8aJIHxkutRlWMRNSvpq6w,"AUiX65HxQqwk1yvsBcbTdQ, se9MhDAQjACYMO3LCIfT1Q, 563C7-HcjhZwZSl4fK-mfQ, _TqUO2XaxLQ9i_z3RM8puQ, FMoKoSHgitwnt_iMWm31nQ, qeFGUu1WPvMMNn5Hno6D-Q, Q0fcX_1wvdmffqEPa246rg, xOZ7bkrttSIGS4NZm49w5Q, 0SBDr7GJAFzKECE7IIWfJA, hJNjKc4sKgWG__KitlJ1ag"
93,x_Frpa8QWc25FDJ5BJM8tg,"se9MhDAQjACYMO3LCIfT1Q, APN05ziH92oIox8EMxcceg, xbCNlp2vWixy2W1WsfGv8g, xWuzWH8qYaa75REqVd9Isw, qDPn14lenAGehkbnJaqnYg, 366NwqHwhOic5pBN1DjmDQ, K8D_ltZWGvdXUaSE7bBiDw, nJdNzQ5Z278gTCFJ4HQBLA, EiYE3T3hfqcpcficZ4zJzQ, xOZ7bkrttSIGS4NZm49w5Q"
94,BhYROfCjIJsKUk22_IVHig,"xbCNlp2vWixy2W1WsfGv8g, Sqwa2aNwnqCmc95gVWQ9bA, 5Iin0tl6QJT_TyL1BldtyA, Kcg5iMwYq5ibBuEhDXKx3Q, 563C7-HcjhZwZSl4fK-mfQ, adI5BlJCtvWq2uAwmyndXA, se9MhDAQjACYMO3LCIfT1Q, 47Uu-2MceSRFmohdzCOvGQ, vL44Ky9VxUtOgteyHasRIA, QMySP-qHdwQNZY0gDba0ng"
95,CD-cuKfj2wybw2DDQbp5Wg,"csbBCysrsifg8N10c0eHCA, V8vKFvdrvhTrQrt-rxKrPA, wNy3CnWWAnTCfDYsZTSUPw, xOZ7bkrttSIGS4NZm49w5Q, BmrVL3Aj5usPfpu5DE1iCg, PiT0jyLL2Jwm2ODTDapOcg, LUhVj-r2TtmFx6cyF9ilJg, vL44Ky9VxUtOgteyHasRIA, 563C7-HcjhZwZSl4fK-mfQ, 8axxI33rUyswfRk_v3vS0A"
96,Q7fH0eiQbLyI8MDTLHU4aw,"6MR9GZjWjLAS3s39YdDXKw, 366NwqHwhOic5pBN1DjmDQ, cgEzHZQKhi2anXfyF75MQw, AUiX65HxQqwk1yvsBcbTdQ, xjBvbDmbsA0VX-vA55SbAA, EIZnpMr9ccgutaGzGjzZ9g, BTl6GE8YLimhTnjGQhGxmg, utYpyFOjNisHl1h7lDGSGA, l_tk3iLmyKfBUCK-6nBbHg, ujUEnwAAhfNOe_LMYEFJrw"
